id,title,genres,popularity,rating,description
103,Akazukin Chacha,"['adventure', 'comedy', 'fantasy', 'romance']",5397,7.41,"Chacha is a cheerful girl who spends most of her days practicing magic under her teacher Seravi, hoping to become as skilled as he is. Though Chacha is enthusiastic, her tendency to make unfortunate puns out of her magic chants leaves her teacher wondering if she is ready for magic school. Deciding that there is no better time, Seravi gifts Chacha the Princess Medallion, allowing her to transform into a magical princess capable of defeating even the fiercest opponents.

Together with her best friends Riiya, a werewolf boy, and Shiine, an apprentice of Seravi's old rival, Dorothy, Chacha sets out to defend the world from sinister forces. However, between the Great Evil Lord plotting against them, Riiya and Shiine's rivalry to win Chacha's affection, as well as Seravi and Dorothy's complicated relationship, Chacha struggles to find balance between fighting evil forces and mending relationships in her everyday life. Though obstacles continue to come her way, Chacha is determined to overcome any problem she faces with love, courage, and hope by her side.

[Written by MAL Rewrite]"
104,Ayashi no Ceres,"['adventure', 'drama', 'horror', 'romance', 'supernatural']",2866,7.17,"Ceres was a tennyo (Celestial maiden) who came down from the heavens to bathe in a stream. She hung her hagoromo (robe) on a tree nearby, which was her key to returning to the heavens. But the robe was stolen and the man who had stolen it forced her to become his wife, thus producing a family full of human and tennyo blood mixed.

Now, in modern day time, Aya Mikage is a descendent of Ceres, and has quite an amount of tennyo blood. On her 16th birthday, she and her twin brother, Aki, are thrown a party. At the ""party,"" Aya's grandpa plans to kill her, for she has tennyo powers unlike the rest of the family, and can actually become Ceres herself and destroy the Mikage family. Aya, however, can switch back, so this transformation happens quite frequently.

With protector Yuuhi by her side, it is up to Aya to control Ceres and keep her from coming back, but her relationship with an ex-worker for her evil grandpa may be a distraction."
105,Boys Be...,"['comedy', 'romance']",4645,6.39,"There are two sides to every love story, and Boys Be... reveals what's really going on—from the guy's point of view!

Meet three normal high school guys with just one thing on their minds: girls. Quiet Kyoichi has been friends with Chiharu ever since they were young, but lately, his feelings have begun to change. Lecherous Makoto, a self-proclaimed master of the rules of romance, is ready to sweep the ladies off their feet. And Yoshihiko, a handsome sports nut, is unfortunately a bit clueless in matters of the heart.

Join this hapless trio for a year of romantic misadventures that will change their lives forever!

(Source: RightStuf)"
106,Hana yori Dango,"['drama', 'romance']",2865,7.58,"Makino Tsukushi, a girl who comes from a poor family, just wants to get through her two last years at Eitoku Gakuen quietly. But once she makes herself known by standing up for her friend to the F4, the four most popular, powerful, and rich boys at the school, she gets the red card: F4's way of a ""Declaration of War."" But when she doesn't let herself be beaten by them and is starting to fall for one of the F4, Hanazawa Rui, she starts to see that there is more than meets the eye...

(Source: ANN)"
107,Ou Dorobou Jing,"['adventure', 'comedy', 'fantasy', 'sci-fi']",3739,7.18,"Jing may appear to be a young boy, but his remarkable skills make him one of the most feared thieves on the planet. Along with his feathered partner Kir, Jing travels from town to town, stealing anything of value regardless of the amount of security. But when he's in a pinch, he has one more trick up his sleeve: Kir bonds with Jing's right arm to perform the effectively deadly ""Kir Royale"" attack. And because of all this, Jing is infamously known by many as the ""King of Bandits."""
108,Ou Dorobou Jing in Seventh Heaven,"['adventure', 'comedy', 'fantasy']",5912,7.24,"Jing, the infamous King of Bandits, finds himself and his feathered partner Kir behind bars in Seventh Heaven, the most notorious prison complex in the world. There, they seek to steal the Dream Orb from the convict Campari. But before doing so, they must escape from the prison of dreams that Campari has conjured for them."
109,Bakuretsu Tenshi,"['action', 'adventure', 'sci-fi']",2643,6.78,"In Japan's not-too-distant future, crime has become so common that the government has legalised firearms for citizens to use in self-defence. To combat this new wave of wrongdoing, the Recently Armed Police of Tokyo was established in hopes of hunting down criminals with lethal force.

Kyohei Tachibana is a gifted culinary student who dreams of saving up enough money to become a pastry chef in France. When four young mercenaries ask him to be their cook, he's forced into making a tough choice. As Jo, Meg, Sei, and Amy take on the bloodiest jobs in the chaotic city of Tokyo, Kyohei accepts an imminent descent into the world of crime—and he'll do a lot more than just cooking!"
110,Chuuka Ichiban!,"['action', 'comedy', 'drama', 'gourmet']",4994,7.59,"The story takes place in 19th century China during the Qing Dynasty, where the Emperor was weakened and the country was close to chaos. It is also during a fictitious era called ""The Era of the Cooking Wars"". It was an era in which top chefs with different cooking styles tried their best to improve their skills and to become the best chef in China. It is a country where insulting a high-grade chef or fooling around with cooking could land a person in a jail, and impersonating a top-chef is as good as usurpation of authority. Chefs compete with each other in order to gain respect and even power, but also with the risks of losing everything.

The country of China has four major regions: Beijing, Szechuan, Shanghai, and Guangdong.

The beginning of the story takes place in Szechuan, Mao's birthplace.

After the death of Mao's mother, Pai, who was called the 'Fairy of Cuisine', Mao becomes a Super Chef in order to take the title as Master Chef of his mother's restaurant. However, before he takes his mother's place as Master Chef, he continues to travel China in order to learn more of the many ways of cooking, in the hopes of becoming a legendary chef, just like his mother. During his journey, he meets great friends and fierce rivals who wish to challenge him in the field of cooking.

(Source: Wikipedia)"
111,Corrector Yui,"['adventure', 'comedy', 'sci-fi']",5276,6.86,"Yui is an average schoolgirl who lives in a future where all computers are supported by a single global network known as COMNET. Yui is a computer-illiterate girl who after a computer-lab accident is approached by IR, a raccoon looking corrector computer program, which tells her she must save COMNET. She must stop the rogue A.I. (Artificial Intelligence) computer program known as Grosser and his hench-programs from taking over the world. Grosser was originally designed to be that manager of all of COMNET. At first she's very reluctant to play the heroine because of her complete lack of knowledge and ability with computers. To save COMNET she must find and gain the trust of the other seven wayward corrector programs. They must also find the creator or COMNET Professor Inukai, to help stop Grosser for good.

(Source: ANN)"
112,Chou Henshin Cosprayers,"['action', 'adventure', 'comedy', 'fantasy', 'sci-fi', 'ecchi']",6838,4.83,"Koto unknowingly seals away the Sun Goddess Amaterasu, and now she is in a different world and can't return. Meeting priestesses who combat the evil in this strange place she learns that Black Towers throughout the land keep Amaterasu sealed away and are guarded by evil monsters. Koto must now find a way to help defeat these monsters and return the world to the way it was.

(Source: ANN)"
113,Uchuu no Stellvia,"['action', 'romance', 'sci-fi']",4544,7.33,"In the year 2167, a wave of radiation released by the supernova of the nearby star Hydrus Beta caused cataclysmic damage on Earth, leaving millions dead. Now, it is the year 2356. United to rebuild Earth, humanity prepares for the supernova's second wave of destruction. 

In order to protect the planet from future harm, massive space colonies called ""Foundations"" have been built throughout the Solar System. Acting as centers for both knowledge and exploration, it is at one of these Foundations—the Stellvia—that Shima Katase applies to be a preparatory student against her mother's wishes, aspiring to see space directly with her own eyes.

At the Stellvia, Katase trains to become a pilot and hopes to be selected for the ""Great Mission"" to shield Earth from the second wave. While she struggles with both her pilot classes and her tumultuous social life, she slowly grows into someone who might just be able to protect humanity.

[Written by MAL Rewrite]"
115,Ijigen no Sekai El-Hazard,"['adventure', 'comedy', 'fantasy']",6064,6.78,"Miz plans to retire as a Great Priestess of Water to married life with her darling Fujisawa and as replacement the young Qawoor Towles arrives to Floristica. Jinnai sees Qawoor's initiation ceremony as a chance to infiltrate Makoto's laboratory but accidentally activates a mysterious thingy that sends them all through the dimensions to a grey industrial city protected by a huge castle in an alternative world.

(Source: ANN)"
116,Shinpi no Sekai El-Hazard (TV),"['adventure', 'comedy', 'fantasy', 'romance']",5151,6.93,"High school science-whiz Makoto Mizuhara is working on his newest project in preparation for the school festival, alongside his best friend Nanami Jinnai. Nanami's brother and Makoto's lifelong rival, the unscrupulous student council president Katsuhiko Jinnai, is under scrutiny for mishandling the school festival planning and is convinced that Makoto is plotting to steal his position. One night, as Makoto and Nanami are taking a break with their teacher Masamichi Fujisawa, Jinnai sneaks into the science lab and sabotages Makoto's device, which suddenly opens a portal that flings all four of them into another world!

Upon arrival, Makoto is immediately attacked by a horde of giant bug monsters. While running from them, he comes across Fujisawa and a girl named Rune Venus. After Fujisawa fights off the monsters, a group of dignitaries arrives, looking for Rune, their princess. They inform Makoto and Fujisawa that they are in a world called El-Hazard and take them back to the palace of Roshtaria, their kingdom. Though her advisors are suspicious of the newcomers, Rune decrees that they are to be treated as guests and quickly befriends Makoto. Unaware that Nanami and Jinnai are in this world as well, Makoto gets to work trying to figure out a way back to Earth.

[Written by MAL Rewrite]"
117,Shinpi no Sekai El-Hazard,"['adventure', 'comedy', 'fantasy', 'romance']",4966,7.25,"After Makoto Mizuhara agrees to testify against the boisterous student council president Katsuhiko Jinnai for bribing school clubs in the recent student council elections, Jinnai chases him down in an attempt to silence his self-proclaimed rival. Suddenly, during the chase, time stops for everyone—except Makoto. Perplexed, he wanders around the campus until he notices a light coming from the school's closed-off basement, where an ancient relic had just been uncovered.

Makoto is walking toward the artifact surrounded by strings of light, when out of it comes an otherworldly woman who claims she has been waiting for ten thousand years to see him. Weakened by the passage of time, she uses her remaining power to transport a confused Makoto to another world, which she refers to as El-Hazard. However, others who are still at school are also caught in the spell, namely: Jinnai; Masamichi Fujisawa, the alcoholic teacher; and Nanami Jinnai, the headstrong sister of president Jinnai.

The fantastical and magnificent world of El-Hazard awaits these four individuals where they will become entangled in the story of its inhabitants and embark on an adventure filled with laughter, danger, and even romance.

[Written by MAL Rewrite]"
118,Shinpi no Sekai El-Hazard Season 2,"['adventure', 'comedy', 'fantasy']",6679,6.77,"Continuing the from OVAs; When Fujisawa, suffering from cold feet, leaves Miz at the altar, an enraged Priestess drafts Makoto and friends to go find him. In the couse of locating the hapless (and gutless) teacher, they find another Ifurita. Meanwhile Jinnai and Diva searching for a new Bugrom homeland stumble upon another yet another Demon God, the impish Kalia. However, unlike Ifurita she has a mind, and a mission, of her own... 

(Source: ANN)"
119,Final Approach,"['comedy', 'drama', 'romance']",3850,6.5,"Ever since their parents died a few years ago, Ryo and his sister Akane have been living alone together. Despite their difficult situation, they are still living reasonably happy and normal lives. However, everything is about to be flipped upside-down due to a secret government project. Due to increasingly low birth rates in Japan, the Japanese government is testing a program in which two young people are forced to marry. Ryo wants no part of it, but he is given little choice in the matter; his new fiancée, Shizuka, comes to his home late one night with several dozen government issued bodyguards, who are there to ensure the success of the new couple. Unlike Ryo, Shizuka couldn’t be more willing to go along with this new program, and eagerly goes about her wifely duties, despite his objections. With meddling friends, pushy bodyguards, and an overenthusiastic new fiancée, Ryo’s life has taken a turn in a direction the young man certainly didn’t expect.

(Source: ANN)"
124,Fushigi Yuugi: Eikouden,"['adventure', 'drama', 'fantasy', 'romance']",5205,6.8,"After years of hardships interfered with their love, Miaka Yuuki and Taka Sukunami are finally married and expecting a baby—the pinnacle of their unbreakable bond. Unfortunately, not everyone rejoices alongside the blessed couple. Mayo Sakaki, one of Taka's students, has a crush on him and cannot bear witnessing the pair's flourishing relationship.

Upon discovering The Universe of the Four Gods, Mayo learns that the old book is where Miaka and Taka first met as the priestess of the god Suzaku and the god's Celestial Warrior Tamahome. Unscrupulous about destroying a happy family, Mayo readily ventures inside with hopes of becoming the new priestess of Suzaku and rewriting the story to her advantage.

Meanwhile, her actions do not delay to show devastating effects. Leaving an unconscious Miaka at the hospital, Taka must follow Mayo to The Universe of the Four Gods and stop her before the circumstances worsen for his wife and their unborn child.

[Written by MAL Rewrite]"
125,Futakoi,"['comedy', 'romance']",3858,6.42,"With his mother dead and his father working abroad, Futami Nozomu returns to the town where he lived as a child, to attend high school and work part-time at a local shrine. He soon finds himself caught up in a local legend of twin girls loving the same man. And there are many twin girls in this town....

(Source: ANN)"
126,Futakoi Alternative,"['comedy', 'drama', 'romance']",4096,6.84,"The Futaba Detective Agency, being run by Rentarou, who has taken over the family business, after his father's death 3 weeks ago. Along with Sara &amp; Souju, his live-in identical twin assistants. He ends up running afoul of the local Yakuza.

(Source: ANN)"
127,Gate Keepers,"['action', 'comedy', 'fantasy', 'sci-fi']",4754,6.91,"Technology, science, and industry—this is 1969 Tokyo, and there is no better time to be alive! But a shadow looms quietly around every corner: ""Invaders"" have infiltrated the populace, and nobody knows who or what they are.

Only the members of the top-secret agency AEGIS know of their existence. Covertly fighting the enemy is their job, but only those with the ability to open ""Gates"" to another world can truly defeat them. Within AEGIS is a specialized task force known as the ""Gate Keepers."" Composed of extraordinary individuals with a variety of Gate-related abilities, they are the only ones who can save humanity from the vicious Invaders plaguing the planet.

Shun Ukiya is an average high school student who lives with his widowed mother and little sister. While on his way home from school one day, he comes across a group of Invaders heading toward his house. In a desperate plight to save his family, Shun discovers he possesses the ability to open a Gate, allowing him to harness massive amounts of energy. With his newfound ability exposed, he catches the attention of AEGIS, and particularly the interest of one of its Gate Keepers, Shun's childhood friend Ruriko Ikusawa.

[Written by MAL Rewrite]"
128,Gate Keepers 21,"['action', 'drama', 'sci-fi']",6335,6.74,"Thirty-two years have passed since the initial defeat of the Invaders. A.E.G.I.S is all but dismantled now and has become an underground organization consisting of only a few Gate Keepers left to save humanity. One of the members, Ayane Isuzu, is sick of society as a whole, though she continues to defeat the Invaders out of spite for her father. Suddenly, she learns of the revival of Machine General (Kikai Shogun) and Devil Count (Akuma Hakushaku), but a mysterious ghost girl now accompanies them. It is up to Ayane and the remnants of A.E.G.I.S to stop them and save humanity once again.

(Source: ANN)"
129,Gensoumaden Saiyuuki,"['action', 'adventure', 'drama', 'fantasy']",3044,7.54,"Many years ago, humans and demons lived in harmony. But that unity ended when demons started attacking humans and plotted a mission to unleash Gyumao—an evil demon imprisoned for thousands of years. Now, Genjo Sanzo, a rogue priest, must team up with three demons—Sha Gojyo, Son Goku, and Cho Hakkai—and embark on a perilous journey to the west to stop these demons from resurrecting Gyumao and restore the balance between humans and demons on Earth.

(Source: ANN)"
130,Saiyuuki Reload,"['action', 'adventure', 'comedy', 'drama', 'supernatural']",3842,7.36,"Priest Genjo Sanzo and companions Cho Hakkai, Sha Gojyo, and Son Goku maintain their westward journey to stop the resurrection of the demon Gyoumao. As the reputation of the Sanzo Ikkou precedes them, they continue to fight demon assassins at every turn, but they must also deal with increasing tensions within their group in order to defeat a powerful enemy. 

(Source: ANN)"
131,Saiyuuki Reload Gunlock,"['action', 'adventure', 'comedy', 'drama', 'supernatural']",4653,7.37,"The Sanzo Ikkou continues its westward journey, on a mission to prevent a demonic resurrection. As Genjo Sanzo, Cho Hakkai, Sha Gojyo, and Son Goku fight their way to their goal, their path is fraught with internal strife. When they encounter a formidable pair of adversaries from the west, the cohesion of the group -- and the fate of the mission -- may be at stake. 

(Source: ANN)"
141,Jinki:Extend,['sci-fi'],6069,6.05,"Aoba is a young girl who loves to build models of robots. She lived alone with her grandmother until her grandmother passes away. Shortly after she is kidnapped and brought to a secret base where she discovers a huge robot. The piloted robots fight against Ancient-Jinki in The Grand Savanna, but the true meaning behind the fights is hidden. Aoba works hard at the base so one day she can pilot one of the robots and discover these secrets."
142,Kamikaze Kaitou Jeanne,"['action', 'drama', 'mystery', 'romance', 'supernatural']",3000,7.46,"A normal looking high school girl on the outside, Kusakabe Maron is actually the reincarnation of Jeanne d' Arc. With the help of the angel, Fin Fish, Maron works as the thief Jeanne at night to seal the demons that reside in pieces of artwork, preying upon the weak hearts of the owners. She is branded as a thief due to the fact that the artworks disappear after she seals the demons. One day, a new neighbor and classmate appears, as well as a rival in her night job, the thief Sinbad. With her own best friend being the detective's daughter, out to capture her and the appearance of her new rival, Maron's work is anything but easy."
143,Kannazuki no Miko,"['drama', 'girls love', 'supernatural']",2633,6.8,"Kannazuki no Miko begins in the village of Mahoroba, where time passes slowly for both man and nature. Two students from the village's prestigious Ototachibana Academy might as well be night and day. Himeko is shy and unassertive, while Chikane is bold and elegant. Despite this, they love each other, and nothing can come between them, no matter how hard they try.

On the two girls' shared birthday, a sinister voice corrupts one of their friends into attacking them, and just when it seemed grimmest, the lunar and solar priestess powers that lay dormant in the two girls awaken, dispelling the evil. That was only the first hurdle, however. The two must now fend off the countless others who would threaten their well-being—even the people closest to them!"
144,Kanon,"['drama', 'romance', 'supernatural']",2774,7.06,"It’s been 7 years since Yuuichi Aizawa visited his aunt Akiko, but now that his parents have gone to Africa to pursue their careers, he is finally back in the little northern town. Yuuichi is not really overjoyed with the prospect of living here though, because all of his memories of this place and the people living in it have mysteriously vanished. His cute cousin Nayuki seems like a stranger as well, even though he used to play with her all the time when they were younger.

On the day of moving into his new home, Yuuichi starts unpacking the boxes and stumbles upon a red headband that no one seems to recognize. This is one of the first clues that will make Yuuichi take a stroll through the snow-covered town and make him start recalling fragments of his past, broken promises and buried secrets. Yuuichi soon realizes that there is something supernatural going on, and all of his new female acquaintances seem to have links to his forgotten past."
146,Kono Minikuku mo Utsukushii Sekai,"['comedy', 'drama', 'romance', 'sci-fi', 'ecchi']",2894,6.69,"High school student Takeru Takemoto works part time as a (motor)bike courier. During one of his deliveries, he saw a mysterious light passing him and fell into a forest. What he had found was a beautiful girl coming out from a glowing cocoon, calling herself ""Hikari."" While Takeru was quite embarrassed because of Hikari's nudity, a strange monster suddenly showed up and immediately attacked the two. Both Takeru and Hikari demonstrated the power of their other selves before Takeru had a clue of what's going on.

(Source: ANN)"
148,Kita e.: Diamond Dust Drops,"['drama', 'romance']",6648,6.56,"If a couple sees the diamond dust together, then they will certainly find eternal happiness. Or so it is said. This is a drama about the romances, friendships and conflicts of six girls from Hokkaido and how the diamond dust affects them and eventually links them together in the search for happiness. 

(Source: ANN)"
151,Re: Cutie Honey,"['action', 'comedy', 'girls love', 'sci-fi', 'ecchi']",4136,7.13,"The last words spoken to Honey Kisaragi by her father before his death at the hands of the mysterious organization Panther Claw have shaped her way of life. It is the sole reason she still continues to fight for the sake of others.

The energetic Inspector Natsuko Aki does her absolute best to apprehend the members of Panther Claw and bring them to justice, but they are simply too much for the police to handle. The only one who can give these criminals a run for their money is the sexy warrior of love and justice, Cutie Honey—the secret alter ego of Kisaragi. Although Natsuko refuses to acknowledge vigilantes, her relationship with Honey progresses for the better as the strong-headed detective realizes the true intentions behind Honey's actions.

Overtime, Honey grows more fearful of her burning desire for revenge; meanwhile, Natsuko wants to protect her friend, a sentiment that clashes with her ideals of upholding the law. If they ever hope to stand a chance against the menacing Panther Claw, the duo will have to put aside their differences and stand together.

[Written by MAL Rewrite]"
152,Solty Rei,"['action', 'sci-fi']",4142,7.25,"In a future-based disaster-ridden city with an enormous gap between the rich and the poor, it is hard to tell which humans are walking around with cybernetic body parts. This makes Roy Revant's job as a renegade bounty hunter/bodyguard-for-hire even more difficult. When a young girl with unbeliveable strength rescues him from a particularly dangerous criminal, Roy realizes that perhaps help can be found in the strangest of places. Joining together with a few others, they engage in a battle to find out the truth behind the giant conglomerates that are supposedly serving mankind and making life better.

Solty, an android who has lost her memory, has escaped and is being hunted by the RUC Security Bureau. She encounters the bounty hunter Roy and he adopts her as his daughter after being hired as a bodygaurd for Miranda.

(Source: ANN)"
