id,title,genres,popularity,rating,description
155,X/1999,"['action', 'drama', 'fantasy', 'mystery']",3677,6.56,"The future of the universe rests on one young man, Kamui Shiro, who must destroy either the Dragons of Earth or the Dragons of Heaven - two opposing armies. He alone must decide whether humanity should be destroyed to create a purified universe, or whether it should be protected to preserve civilization.

Two oracles, the sisters Hinoto and Kanoe foresee the coming of the Dragons and predict opposite outcomes. Each sister gathers strength and ammunition to insure her own vision for the future. However, neither sister realizes that there is one man who has an even greater power than the Dragons, and that ultimately he will determine the fate of the earth.

Which sister will prevail and how does Kamui fit into their struggle? The answer to this question will forever affect humanity.

(Source: Manga Entertainment)"
158,Maria-sama ga Miteru,"['drama', 'girls love']",2650,7.28,"When Yumi Fukuzawa entered the Lillian Girls' Academy, a prestigious all-girls Catholic school in Tokyo, she never imagined she would catch the eye of beautiful and demure Sachiko Ogasawara, one of the school's most popular students. Now Sachiko has offered to be Yumi's soeur, her ""sister"" and guide for all her years at the academy. The whole idea has Yumi completely flustered—after all, they hardly know each other!

The entire campus is abuzz with rumors about the two of them, but Yumi is conflicted over accepting Sachiko's offer. While she admires Sachiko, being her soeur would also mean constantly being at the center of the entire school's attention!

(Source: RightStuf)"
159,Boukyaku no Senritsu,"['action', 'adventure', 'fantasy', 'horror', 'sci-fi']",5085,6.26,"A great war occurred in the 20th century between humans and monsters. Since that time, the monsters rule the world in fear but keep relatively hidden from public view. A boy named Bokka ponders the past and wonders what became of the Meros Warriors who defended the world so bravely against the demons. He soon meets Kurofune and learns of the power of the Meros and the I-bar machines they ride in battle. Warriors are the only ones who can see and hear the Melody of Oblivion, a phantom girl hidden away waiting to be rescued and be the savior of mankind. During a battle between Kurofune and a demon, Bokka discovers something only his wildest dreams could possibly imagine...he too can hear that melody. Throughout his journeys, Bokka meets many monsters and their agents, friends, and companions as he discovers the true extent of his new powers. He must continue to battle evil in the hope of releasing Boukyaku no Senritsu and free a world that has forgotten its once beautiful melody.

(Source: ANN)"
161,Peace Maker Kurogane,"['action', 'comedy']",2979,7.29,"Although traumatized by witnessing the murder of his parents by one of the Choushuu, Ichimura Tetsunosuke's thirst for revenge lead him to desire strength. At the age of 15, Tetsunosuke approached the Shinsengumi, wanting to become one of its members. However, Tetsunosuke lacked the skill, mind and will to emotionlessly cut down whoever threatened peace and the Shinsengumi. Even with the support of his brother Tatsunosuke and his newfound friends of the Shinsengumi, little did Tetsunosuke know the blood and pain he would have to face being part of this historical group."
162,Pita Ten,"['comedy', 'fantasy', 'romance']",4620,6.91,"Kotarou was pretty much supposed to be your average boy, worried about the pressures of education while enjoying a simple life with his friends. Much to his despair, he one day finds the overly cheerful Misha at his door, asking to be friends out of nowhere. Even more shocking is that Misha is an apprentice angel, yet she does more bad then good. Along with Kotarou's school friends Takashi and Koboshi and the so called devil Shia (once again being able to do more good then bad), the group of friends spend their days getting into all sorts of adventures and troubles."
163,Power Stone,"['adventure', 'comedy', 'fantasy']",7022,6.46,"An ancient legend tells of a magical Powerstone that granted its owner any wish desired. Adventurers from all over the globe clash as they seek this mystical gem. 

Based upon the Dreamcast game, POWERSTONE tries to entertain us with the story behind the game's premise. The plot begins with our hero, Fokker, training to be a fighter like his idol, Vargas. 

(Source: AniDB)"
171,Strange Dawn,"['adventure', 'drama', 'fantasy']",7885,6.25,"Yuko and Eri are two normal girls who are sucked into the alternate world filled with tiny people. The people of this mysterious world sees them as their ""Great Protectors"" who can protect their land in a time of strife. The two girls set out on a mission with a group of warriors from the village to find out how they were brought here and how might they return home. However, there is a war brewing and these two Great Protectors are the political tool that every faction lusts for to rally the people to their side. 

(Source: ANN)"
173,Tactics,"['mystery', 'supernatural']",3593,7.18,"Ichinomiya Kantarou grew up with the ability to see demons, but was isolated and bullied by others who did not share the same gift. Instead, he became being friends with the demons, gaining a great attachment to their existence. One day, Kantarou was told about the strongest demon, the one known as the ogre-eating Tengu. Amazed by the news of his strength, Kantarou vowed to find this demon who was far stronger than any other, deciding to call him Haruka when he did so. Since this time, Kantarou searched far and wide for the ogre-eating Tengu with no luck, making his living by becoming a folklore writer and demon-buster. On a particular job, Kantarou had finally found news of a nearby shrine supposedly the place where the ogre-eating Tengu was sealed."
175,Tokyo Underground,"['action', 'adventure', 'romance', 'sci-fi']",4184,6.58,"Under the capital city of Tokyo, Japan, there exists a large, vast, and unknown world known as Underground. There, people known as Elemental Users exist; people who have the ability to control the elements: Fire, Water, Lightning, Magnetism, Freeze, etc. Meet Rumina Asagi and his best friend Ginnosuke Isuzu, two average high school freshmen who reside in Tokyo. When they meet Gravity User, Chelsea Rorec, and the Miko of Life, Ruri Sarasa, their whole lives change into one big adventure.

(Source: ANN)"
176,Triangle Heart: Sweet Songs Forever,"['adventure', 'romance']",7451,6.11,"Fiasse is a world-renowned singer. She is now the headmistress of a special Singing School who does a Charity World Tour every year. Her mother left behind a inheritance for her after she died and some shady people are after Fiasse and the inheritance. Bring in Ellis, and two siblings who are master of the swords to protect Fiasse. The World Tour is coming up and Fiasse will continue the show. Ellis, Kyoya, Miyuki and company must protect their childhood friend at all costs. 

(Source: ANN)"
178,Ultra Maniac,"['comedy', 'fantasy', 'romance']",3932,7.15,"Fantasies and miracles never interested Ayu Tateishi, a popular second-year student at her middle school. She was content with preserving her image of being cool, calm, and collected—all to catch the eye of her crush, Tetsushi Kaji. Ayu's carefree youthful days are interrupted by the appearance of Nina Sakura, a new transfer student who turns out to be a witch. As the only person who knows about Nina's ability to cast spells using a mini-computer, Ayu is forced to help Nina with her mission to find the five Holy Stones, qualifying her to marry the prince of the Magic Kingdom.

Unfortunately, Nina's ineptitude with magic and her habit of meddling in Ayu's personal life cause nothing but trouble for the two of them as Ayu toils to maintain her good reputation and Nina struggles to hide her secret from the discerning eye of Hiroki Tsujiai, Tetsushi's best friend and an avid fan of manga. And when Nina's search for the five Holy Stones brings allies and challengers from the Magic Kingdom, Ayu is dragged into a world she never even dreamed was possible.

[Written by MAL Rewrite]"
179,Ultra Maniac OVA,"['comedy', 'fantasy', 'romance']",8277,6.62,"Ayu Tateishi is a popular second-year student at her middle school admired for being calm, cool, and collected. But this carefully preserved image was all crafted to catch the eye of her crush Tetsushi Kaji, who once complimented her for those qualities. Studying, playing tennis, and finding chances to speak with Tetsushi are all that are on Ayu's mind—until the day she finds a mini-computer underneath a bench. 

After returning the item to Nina Sakura, a girl who was searching for a lost item earlier, Ayu is chosen by Nina as a confidante for her secret. When the school's two tennis teams have a dispute regarding use of the courts, Ayu is forced to settle the matter by playing against Hiroki Tsujiai, the captain of the boys' team and Tetsushi's best friend. While dreading the prospect of losing and embarrassing herself, Ayu is approached by Nina, who is revealed to be a witch who came to Earth after failing to graduate from the Magic Kingdom's middle school. Wanting to help Ayu win the match, Nina imbues a piece of chocolate with a spell that just might come in handy...

[Written by MAL Rewrite]"
181,Vandread: The Second Stage,"['action', 'sci-fi', 'ecchi']",3083,7.38,"Though Hibiki and crew defeated a super-huge battleship of the earth in the last of the first stage, they noticed five battleships further aiming at Mejeiru and Tarahk. And, crew of NIRVANA learnt Tarahk and Mejeiru which were their home had been faced to the crisis of Karitori (reaping). Travel to their home is speed up so that they may inform of the crisis. On the way, current information of the earth having been brought by girl Misty who had come to travel with them was worse than they can imagine. Hibiki and crew noticed a true fight was in the future. VANDREAD is finally changed into final system by the attack of the enemy who becomes violent more and more. Can they save their home? And, what happens to the relations between Hibiki and Dita?

(Source: AnimeNfo)"
183,Whistle!,['sports'],5587,7.36,"Kazamatsuri Shou's dream has always been to become a professional soccer player, but he has one problem: he's not very good at the game. He was accepted to the prestigious Musashi no Mori Junior High, known for its top rate soccer team, but he was never able to rise beyond the rank of third stringer. After transferring to Sakura Jousui Junior High, he can finally play soccer. And, with the support of his new friends and teammates, his strong determination, and lots of hard work, his soccer skills are developing rapidly and setting Shou well on his way to achieving his dream.

(Source: ANN)"
184,Xenosaga The Animation,"['action', 'sci-fi']",4916,6.32,"The year is T.C. 4767. Four thousand years have passed since humanity abandoned its birthplace, the planet Earth. Beset by the hostile alien Gnosis, mankind is now scrambling to find ways to defeat this threat to their existence. The development of KOS-MOS (a specialized android with amazing capabilities) by Vector engineer Shion Uzuki was one response to the threat. But when their ship is destroyed by the Gnosis, Shion and her companions find themselves thrust into the middle of a battle with no clear sides...

(Source: Anime-Planet)"
188,Gosenzo Sane,"['comedy', 'mystery', 'supernatural', 'hentai']",10001,6.11,"Masquerade is the story surrounding the Hiraga bloodline in which Gen is a part of. Recently orphaned, he moves in to his grandmother's house and unwittingly triggers the Hiraga clan's curse in which nearly every member leads a tragically short life. In his grandmother's house, Gen begins to unravel vaguely remembered memories from a dream he's always had. With the help of an American graduate student, they try to uncover the secret of the Hiraga bloodline, the whispered legend of immortality that is locked in his genes, and a way to keep Gen from sharing the same fate that every one of his ancestors before him has suffered. 

(Source: ANN)"
191,Love Hina Christmas Special: Silent Eve,"['comedy', 'romance']",2977,7.31,"As another round of preliminary tests approach for Keitaro, so does Christmas. And as the first Christmas of the millenium, there is a rumor that if one confesses his love on this special eve it will come true. Keitaro has decided what he needs to do on this Christmas eve, but being a retaker can he afford taking attention away from the tests on the same day...

The Winter has begun in Hinata. X-mas is coming up. There are rumors about this special christmas eve: If someone is going to confess his love on this christmas eve, any wish will come true. Keitaro decides to confess his love to Naru. But he isn't the only one confessing on this christmas eve...

(Source: ANN)"
192,Love Hina Haru Special: Kimi Sakura Chiru Nakare!!,"['adventure', 'comedy', 'romance']",3130,7.18,"The tests have come, and Keitaro can only hope to succeed. However, in the final stretch, he fails miserably and daydreams through the test. Assuming that he has failed, he runs away, so the rest of the cast hunts him down on a remote desert island to bring him back.
The Toudai entrance exams have finally come (again) for Keitaro. With all his confidence Keitaro sits for the paper, but ends up falling asleep and dreaming about Narusegawa. Waking up with barely any time to complete the paper, Keitaro thinks he will fail the paper and tries to escape from Hinata Lodge and forget all the memories with it. By a stroke of luck he meets Seta, but ends up in a faraway island with the whole cast trying to look for him.

(Source: ANN)"
194,Macross Zero,"['action', 'adventure', 'sci-fi']",3662,7.49,"Taking place one year before the Zentraedi arrive on Earth, Macross Zero chronicles the final days of the war between the U.N. Spacy and anti-U.N. factions. After being shot down by the anti-U.N.'s newest fighter plane, ace pilot Shin Kudo finds himself on the remote island of Mayan, where technology is almost non-existent. While Shin stays on the island to heal his wounds, the tranqulity of the island is shattered by a battle that involves the UN's newest fighter - the VF-0. 

(Source: ANN)"
197,Rizelmine,"['comedy', 'romance', 'sci-fi', 'ecchi']",4513,6.5,"Iwaki Tomonori is an average 15-year-old boy who likes older women. He happens to have a crush on his teacher, but soon thereafter, learns she has become engaged. He heads home brokenhearted, only to find a 12-year-old girl named Rizel at his home, who he learns the Japanese government has married him to against his will. Furthermore, he learns Rizel is no ordinary girl; she is a biochemically engineered human, and her creators (her ""papa""s, as they are often referred to) promise to waive multiple bills of Iwaki's parents in exchange to be allowed to stay at their house, and thus Iwaki's life with Rizel begins."
200,Tenshi na Konamaiki,"['comedy', 'romance']",4274,7.42,"Megumi-chan is a girl with a secret past. She used to be a boy until she met a person she thought was a magic user. This person gave him/her a magical book from which a genie appears to grant one wish when blood is applied to it. Megumi made the wish to be a man in a man's body but the genie has a twist: he grants wishes backwards so he turns Megumi-kun aged 9 to Megumi-chan. Years pass and Megumi enters High School where she immediately beats up the school bully who of course falls in love with her. She is looking for that book again to be able to reverse the spell placed upon her.

(Source: ANN)"
201,Video Girl Ai,"['comedy', 'drama', 'romance', 'ecchi']",4118,7.19,"After a crushing rejection, the heartbroken Youta Moteuchi trudges home. On his way, a dimly lit video store catches his eye, and he ends up purchasing a ""video girl"" tape meant to ease the hearts of lonely men. However, when he tries to play it in his broken VCR, a beautiful girl leaps out of his TV and lands on his bed. Calling herself Ai Amano, she looks like a golden opportunity for Youta to finally experience true love—that is, until her personality, now troubling thanks to the broken VCR, shows through. Despite her flaws, however, Ai wholeheartedly promises she will ensure Youta finds happiness and true love in his life.

Video Girl Ai follows the daily life of a teenage boy and his pursuit of a fulfilling romance. With the help of his virtual guardian angel, Youta sets forth to find the girl of his dreams.

[Written by MAL Rewrite]"
203,Words Worth,"['adventure', 'fantasy', 'hentai']",6907,6.71,"The legend has survived for generation. The Words Worth tablet, which will unlock the secrets of the Universe for the one who can decipher it, has been shattered. The warring tribes of Light and Shadow blame each other, and their accusations lead to all out war!

Astral, the undisciplined heir to the throne of the Shadow Forces, lusts for his bride-to-be, Sharon. But Sharon, an accomplished warrior herself, feels her body drawn toward Caesar, the Shadow Tribe`s bravest swordsman.

Sharon battles alongside Caesar during an assault by the Light Forces, and her ferocious beauty captivates Sir Fabris, the leader of the Tribe of Light. Fabris` army loses the battle, but he vows that he will one day get Sharon into his bed, the hard way, if necessary.

Meanwhile, Astral takes his sexual frustrations out on Maria, a Light Tribe sorceress who has been taken captive. As Astral penetrates Maria, Sir Fabris prepares to launch a penetration of his own: a full-scale attack on the Tribe of Shadow!

(Source: AnimeNfo)"
204,Yumeria,"['action', 'comedy', 'ecchi']",4285,6.06,"On his 16th birthday, Tomokazu Mikuri had a realistic dream where he sees a girl battling a giant floating monstrosity. When he wakes up, he is surprised that the girl is actually sleeping next to him... Whenever he sleeps from now on, he ends up back at the dream world, and more and more people that he knows keep showing up there too. He finds out from a mysterious masked woman in the dream world named Silk that they are fighting against one named Faydoom, and he is the one who provides the powers to those girls so that they can fight these monsters. And so it goes...

(Source: ANN)"
206,Lodoss-tou Senki: Eiyuu Kishi Den,"['action', 'adventure', 'drama', 'fantasy', 'romance']",3874,7.11,"Five years after the death of the Emperor of Marmo in the War of Heroes, Parn is now the Free Knight of Lodoss, he and his old allies now famous through the land. However, the Emperor's right-hand man, Ashram, seeks the scepter of domination to re-unify Lodoss under his former leader's banner. Meanwhile, beyond his attempts at conquest lies a more sinister force beginning to set the stage for the resurrection of the goddess of death and destruction...

(Source: ANN)"
208,R.O.D: Read or Die,"['action', 'adventure', 'mystery', 'sci-fi']",2704,7.61,"Yomiko Readman is a lovable, near-sighted bibliomaniac working as a substitute teacher at a Japanese high school. Her real identity, however, is that of a secret agent for the British Library Special Operations Division. Her codename: ""The Paper."" The moniker denotes her supernatural ability to freely manipulate paper into any object she can imagine, including tools and weapons in her fight against the powerful and self-serving IJIN (Great Historical Figure) Army! Along with her partner, the enigmatic ""Ms. Deep,"" Yomiko travels across the world in attempt to solve the mystery behind the reincarnation of historical figures and their attempt to control the world.

(Source: RightStuf)"
209,R.O.D: The TV,"['action', 'adventure', 'comedy', 'drama', 'sci-fi']",2692,7.52,"Anita King, Maggie Mui, and Michelle Cheung are the Paper Sisters. They run the Three Sisters Detective Agency in Hong Kong which is dedicated to solving cases involving books. They are hired as local guides for Nenene Sumiregawa, a Japanese novelist who has been struggling with writer's block following the disappearance of her longtime friend, Yomiko Readman. The sisters are all Paper Masters—individuals with the power to control paper—and with their abilities, they save Nenene from the dangerous terrorists targeting her at a book signing. But in case they strike again, the sisters remain as her bodyguards to protect her from further harm.

This is a dream come true for bookworms Maggie and Michelle who love Nenene's stories, but the young Anita cannot stand books despite her powers over paper. The three struggle to adapt to their new daily life in Japan, guarding Nenene while continuing their detective work under a mysterious organization, Dokusensha. However, the more they get to know Nenene, the more they discover the link between her, the disappearance of her friend Yomiko, and the mysterious books Dokusensha sends the Paper Masters to investigate. What began as a simple job ends up a bigger case than they have ever had before. Are these girls really willing to risk their lives over literature?

[Written by MAL Rewrite]"
211,Pure Mail,['hentai'],9490,6.18,"Episode 1:
""There is no need for relationships"". Kei Ogata carried with him a trying, sad past. His only joy in life was chatting and mailing as a different person on the internet. One day he met a kind gentle girl on the net named Eve became friends with her. As time passed, they began sharing a strong bond of friendship. Then the other day, Kei began suspecting classmate Midori was Eve... 

Episode 2:
The Summer Festival has past. Kei struggles with his own past, trying not to become the monster he hated so much. Midori worried about her best friend Miki look to A.W. for help. Little does she know, that the very A.W. was Kei and that he was Miki's problem. Will Kei be able to confess his love or will he forever be number two to his own alternate identity? 

(Source: AniDB)"
212,Project A-Ko,"['action', 'adventure', 'comedy', 'sci-fi']",4813,6.85,"Sixteen years after its destruction by a meteor, Graviton City has been rebuilt into a futuristic metropolis. However, this is of little concern to superpowered high school student Eiko Magami, who only cares about her best friend Shiiko Kotobuki and arriving at school on time. Unfortunately, the incredibly intelligent Biko Daitokuji intends to befriend Shiiko, taking Eiko's place as the Shiiko's best friend using any means she can.

Biko decides that, to accomplish this, she must defeat Eiko in combat. In order to overcome her super strength and speed, Biko creates a mecha and challenges Eiko in front of their school gate. As the two commence their battle, an extremely large spaceship hovers over Earth, searching for something left behind.

[Written by MAL Rewrite]"
213,Pia Carrot e Youkoso!!,"['comedy', 'hentai']",9346,5.95,"Yusuke Kinoshita is forced by his father to work at his restaurant Pia Carrot all summer due to his bad grades in school. What first seems to be a boring job becomes a memorable experience due to his interactions with his co-workers and his boss. 

(Source: ANN)"
214,Pia Carrot e Youkoso!! 2,"['comedy', 'hentai']",10384,6.1,"Yusuke (from the first Pia Carrot series) returns as the manager with a whole new cast. So the new male lead is Maeda Koji. Despite being late after an ""accident,"" Koji manages to get the job as the Carrot's waiter because he's very persistent. Included within the set are Azusa (the female lead who hates Koji for his perversion), Ryoko (the manager who's sweet on Koji by working him very hard), Aoi (the token alcoholic), Jun (the secret-hiding waitor), and Mina (Azusa's cute little sister). Pia Carrot 2 is served up as a romantic comedy, with a side of hentai.

(Source: ANN)"
215,Pia Carrot e Youkoso!! 2 DX,"['comedy', 'romance']",10172,6.2,"Kouji wants to work part-time, so, when he saw a cute girl with the Pia Carrot uniform, he tried to get a job there. When he's on the way, he accidentally bumped Azusa, and with some misunderstanding, they literally hate each other. What is the surprise of Kouji when he finds that she also got a job in the Pia Carrot, facing her daily. But as time passes, he will discover that 'hate' is not the appropriate word to describe his feelings...

(Source: ANN)"
216,Pia Carrot e Youkoso!!: Sayaka no Koi Monogatari,"['comedy', 'romance']",9964,5.82,"High schoolers Sayaka Takai and Akihiko Kannazuki work together at a restaurant chain ""Pia Carrot."" Both are interested in each other, but before either could make a move Sayaka was temporarily rotated to the newly established branch at a beach resort. While waitress girls at this new location did their best to confront harassment, make new friends, and attract new customers by attending a beauty contest, Sayaka's feeling for Akihiko never stops and has become stronger and stronger.

(Source: ANN)"
217,Shin Angel,"['comedy', 'drama', 'hentai']",9880,6.26,"Kousuke is a high school student. He just recently found out that his childhood friend Shizuka (whom he has a crush on) is now going to his high school. However, they haven't seen each other since they were five and much has changed. They don't like each other at first but they accept each other's differences and continue their friendship. They go on with their lives until small events start to escalate and they start to show affection for each other. In the meantime, Kousuke's good heart, lechery and luck lead him into the beds of various other young women, in his attempts to solve their problems. 

(Source: ANN)"
