id,title,genres,popularity,rating,description
218,Kidou Senkan Nadesico,"['action', 'comedy', 'romance', 'sci-fi']",3054,7.49,"Akito doesn't want to fight. Despite a childhood spent on the anime Gekiganger 3, a Mecha show, he'd rather cook than pilot a Mecha. Fate intervenes when his home on Mars is destroyed, and he is transported instantly to the Earth, mysteriously. He has questions no one can answer fully, but follows a girl from a chance meeting in hopes to discover any. The girl, Yurika, is captain of the private battleship Nadesico, and in order to follow her, he enlists as their cook. Possessing the nanite implants that allow to control mechas, he's a handy backup pilot for the mechas of the Nadesico. He joins a crew bent on avenging Mars that seems to be composed of only misfits, otakus, and ditzes; however, in reality, they are handpicked experts. They take their own private war back to Mars to face the harsh reality that life may not always be like a Giant Mecha series.

(Source: ANN)"
219,Kidou Senkan Nadesico: The Prince of Darkness,"['action', 'award winning', 'drama', 'sci-fi']",5339,6.72,"Two years have passed since the end of the ""Martian Successor Nadesico."" Akito and Yurika have disappeared. The Jovians and the Earthlings have joined forces and Ruri is now captain of Nadesico B. As the popularity of Boson Jumping grows, a vast transportation network has been developed. Dubbed the Hisago Plan, this network of Chulip portals holds the answers to the mysteries behind Bose particles and their power. If those secrets should fall into the wrong hands, it could mean big trouble. And big trouble there is. A Martian splinter group has launched an offensive, leaving the United Forces befuddled and desperate. So much so, in fact, that the former crew of the Nadesico is called back to active duty for a special unsanctioned mission-to save us all. Does this menagerie of misfits have what it takes? Who will win the race for the Boson technology? And what the heck happened to Akito and Yurika?"
220,Kuro no Danshou,"['horror', 'hentai']",10214,5.67,"While vacationing with his adopted daughter, Private Detective Susuki becomes trapped in a secluded ski resort with a few other vacationers after a storm closes the place down. All is well until one of the guests is found brutally murdered. Being the good investigator he is, Susuki gets to work to find the killer. While digging for the killer, Susuki uncovers a lot of dirt on the other guests and even finds out a thing or two about his own past. But, as Susuki struggles to find the killer, the other guests start to point the finger at him. 

(Source: AniDB)"
221,Mezzo Forte,"['action', 'comedy', 'sci-fi', 'hentai']",3906,6.62,"For some individuals, baseball is more than just a game. Momokitchi Momoi, an underworld boss and the owner of a professional team known as the ""Peach Twisters,"" seems to be the perfect example. There is only one punishment for players who have let him down: death. Terrible as he may sound, there is someone even more wicked than him—his daughter, Momomi.

The three members of the Danger Service Agency—Mikura Suzuki, Tomohisa Harada, and Kenichi Kurokawa—are tasked with kidnapping Momokitchi and taking down his criminal empire. Surrounded by armed bodyguards, he is bound to be a risky target. However, born with a gun in hand, Mikura is used to dancing with danger. The only unknown quantity is Momomi, reputed to be a cold-blooded killer with a twisted mind. Should she stand in the DSA's way, Suzuki might finally find herself a worthy opponent.

[Written by MAL Rewrite]"
222,Mezzo DSA,"['action', 'adventure', 'comedy', 'mystery', 'sci-fi']",4654,6.62,"Mikura, Kurokawa, and Harada are the 3 members of the Danger Service Agency (DSA). Mikura is the brawns of the group, Harada is the brains, and Kurokawa is just a bitter ex-cop that likes to think he's in charge. They'll take on any job as long as it involves lots of danger and, of course, money. If you want to live long enough to eat dinner, you better not cross them. Their biggest case, however, could prove to be finding out why someone wants Kurokawa assassinated. 

(Source: ANN)"
