id,title,genres,popularity,rating,description
8,Bouken Ou Beet,"['action', 'adventure', 'fantasy']",5502,6.93,"It is the dark century and the people are suffering under the rule of the devil, Vandel, who is able to manipulate monsters. The Vandel Busters are a group of people who hunt these devils, and among them, the Zenon Squad is known to be the strongest busters on the continent. A young boy, Beet, dreams of joining the Zenon Squad. However, one day, as a result of Beet's fault, the Zenon squad was defeated by the devil, Beltose. The five dying busters sacrificed their life power into their five weapons, Saiga. After giving their weapons to Beet, they passed away. Years have passed since then and the young Vandel Buster, Beet, begins his adventure to carry out the Zenon Squad's will to put an end to the dark century."
17,Hungry Heart: Wild Striker,"['comedy', 'slice of life', 'sports']",4547,7.54,"As the younger brother of Japanese soccer star Seisuke Kanou, Kyousuke was always expected to grow as a soccer player at the same pace his brother did—an expectation that proved too difficult to meet. Having fallen behind, he now lives in the shadow of his brother's success.

Entering his freshman year at Jouyou Akanegaoka High School, Kyousuke vows never to play soccer again. However, Miki Tsujiwaki, the captain of the girls' soccer team, and Mori Kazuto, the manager of the boys' team, recognize Kyousuke's potential and want to see his return to the game for their own reasons.

With an opportunity to play soccer again, Kyousuke must either remain steadfast in his decision to abandon the sport he once loved, or allow himself to reignite that flame to become the best striker in the world.

[Written by MAL Rewrite]"
23,Ring ni Kakero 1,['sports'],8605,6.35,"In order to fulfill their dead father's wish, the siblings Takane Kiku and Takane Ryuji aim for the champion title of the boxing arena. Their sister, Kiku, will act as the trainer while her brother, Ryuji, will concentrate on the role of the boxer and learn the Boomerang. His battle with many rivals has led to the growth and maturing of Ryuji. The junior high boxing tournament has begun and Ryuji will be fighting his arch-rival, Kenzaki Jun. The battle begins.

(Source: ANN)"
29,Zipang,"['action', 'drama', 'sci-fi']",4703,7.49,"A Ripple in Time Turns the Crucial Tide of WWII.

Scheduled for routine military exercises, Commander Kadomatsu and the crew of Japan's newest and most modern Battlecruiser, The Mirai, are ready to test out the ship's state-of-the-art Aegis System. Instead, they find themselves transported back to June 4th, 1942—date of the crucial Battle of Midway, where the Japanese fleet was dealt a crippling blow. When an overzealous Kadomatsu rescues one of the battle's victims, Kusaka, from a sinking zero fighter, the Mirai's fate is sealed. The crew pledges not to do anything to alter the past further. However, they're now forced to fight a U.S. submarine in a battle that should never have occurred. Thus setting off a chain of events that may forever change the flow of history!

(Source: Geneon Entertainment USA, edited)"
46,Rurouni Kenshin: Meiji Kenkaku Romantan - Ishinshishi e no Chinkonka,['drama'],3140,7.55,"The war against the Tokugawa Shogunate ended years ago. But there are some who are not happy with the outcome. Shigure Takimi watched his friends and family get slashed down in the name of freedom and prosperity. Now he and a band of desperate rebels have sworn to settle one final score. Only one man stands in their way: Kenshin Himura. But when Shigure discovers Kenshin's true identity as the Hitokiri Battousai, his fight becomes a personal vendetta.

(Source: ANN)"
49,Aa! Megami-sama!,"['comedy', 'romance', 'supernatural']",3076,7.28,"When college student Keiichi Morisato dials the wrong number while ordering for some food at his dormitory, he accidentally gets connected to the Goddess Hotline and a beautiful goddess named Belldandy appears out of a mirror in front of him. After getting kicked out of the dorm, Keiichi and Belldandy move to an old shrine and soon afterwards, Belldandy's sisters Urd and Skuld move in."
51,Tenshi Kinryouku,"['action', 'drama', 'romance', 'supernatural']",3238,6.24,"Setsuna Mudo is a 16-year-old high school student just trying to get by without running afoul of his bullying seniors. It doesn't help that he's in love with his younger sister, Sara, who only sees him once a month. But there's more to his life than just keeping his head down.

Setsuna is ambushed by mysterious beings, angels, and demons, all professing to know his true destiny. The angels say he is the reincarnation of their leader Alexiel, while the demons claim he led them to war against God himself.

As Setsuna struggles with his identity in such strange times, the eternal conflict between Heaven and Hell threatens to reignite. Will he be prepared when it does?"
52,Kidou Tenshi Angelic Layer,"['award winning', 'comedy', 'drama', 'sci-fi']",2960,7.26,"12-year-old Misaki Suzuhara has just gotten involved in Angelic Layer, a battling game using electronic dolls called angels. Even as a newbie, Misaki shows advanced skills as she meets new friends and enters Angelic Layer tournaments to fight the greatest Angelic Layer champions of the nation."
54,Appleseed (Movie),"['action', 'sci-fi']",2591,7.05,"Growing out of the chaos of a global war, the city of Utopia is populated by humans and bioroids (artificial humans). On the surface, everything is harmonious, but tensions lurk. Into this seemingly perfect society comes a survivor of the wars, Deunan Knute, who carries a legacy that will turn out to be of critical importance to the future of humanity. 

(Source: ANN)"
55,Arc the Lad,"['action', 'adventure', 'fantasy', 'horror', 'sci-fi']",5345,6.49,"The story follows Elk, a bounty hunter in some strange futuristic world. On this world archaic but advanced technology exists side by side with primitive attitudes, beasts and magic. In other words it's got a bit of everything. It also has an evil conspiracy who are able to produce powerful monsters called chimera, who can also appear as human. Naturally it is not long before Elk has rescued a young female beast-master and gained himself some serious enemies. 

(Source: ANN)"
56,Avenger,"['adventure', 'fantasy', 'sci-fi']",5207,5.86,"Mars has been colonized and is a world where children have been replaced by robot servants known as ""dolls."" Layla is a skilled fighter with a tragic past who travels about the world. Her companions are Nei, a strange and unique doll with some unknown ties to Layla, and Speedy, who is a doll breeder. The founders of Mars see the trio as a threat to their world, and each time they attack Layla and Nei a bit more of their mysterious past and future is revealed."
62,D.C.: Da Capo,"['drama', 'romance']",2553,6.71,"Hatsunejima abounds in mysteries—one of which is the town's unwithering cherry trees that are said to grant the most genuine wishes. There are also rumors of people possessing supernatural powers, like Junichi Asakura, who can see other people's dreams and create sweets out of nothing. Alongside his sister Nemu, he enjoys living in peace with his friends at Kazami Academy but chooses to shroud his identity in secrecy.

His tranquil school life comes to a halt when he finds out that his childhood friend Sakura Yoshino has returned from America after six years. She is there for one purpose: to fulfill the promises she made long ago with Junichi. Little does anyone know, however, that Sakura's appearance is bound to change everyone's lives—for better or worse.

[Written by MAL Rewrite]"
69,Cluster Edge,"['action', 'fantasy', 'sci-fi']",6277,6.31,"Cluster Edge Academy isn't just any school; it's THE school, where the offspring of the elite come together to prepare for their roles running a world where artificial soldiers and religious sects are major factors in the battle for total control. Which may be part of why new transfer student Agate Fluorite doesn't quite seem to fit in. It's not just that Agate's enthusiastic attitude stands out among the somber, brooding balance of the student body. There's something about him that demands notice, even from jaded honors students like Beryl Jasper, and from the moment of arrival he's been at the center of a series of mysteries that not even Agate understands. Because Agate's not just another student, he's part of a something so momentous, and dangerous, that the world that built Cluster Edge may not survive its passing. 

(Source: Sentai Filmworks)"
75,Soukyuu no Fafner: Dead Aggressor,"['action', 'drama', 'sci-fi']",3255,7.25,"Tatsumiyajima is the central island in the middle of a small cluster of islands, in a sleepy backwater of the Japanese isles. Not much happens there, and the island's young people go to school knowing that their lives are likely to remain peaceful and undisturbed. Or so they have been taught... but the truth is different. The fate of mankind is on the line, and Tatsumiyajima is the last line of defense against a hostile and incomprehensible enemy. At the center of it all, fighting for Humanity's continued existence, is the giant robot Fafner, the dragon that guards this final treasure of mankind.

(Source: ANN)"
77,Mahou Shoujo Lyrical Nanoha A's,"['action', 'comedy', 'drama']",2792,7.96,"After solving the incident of the scattered Jewel Seeds, Nanoha Takamachi happily returns to her everyday life, though now with added magic practice in the morning. Exchanging video messages with Fate Testarossa and the crew of the Arthra, Nanoha eagerly awaits the chance to speak with them in person again. But while studying in her room one day, Raising Heart suddenly calls out to Nanoha and warns her of an incoming attack!

The attacker is a young girl named Vita, who calls herself a Belka Knight. She proves her strength by using an intelligent device with a mysterious cartridge system to quickly overwhelm Nanoha. Luckily, the Space-Time Administration Bureau is able to step in before she is completely crushed. Vita and her fellow knights Shamal, Signum, and Zafila are on a mission to steal magical power from mages in order to complete the Book of Darkness, one of the Lost Logia. For what sinister purpose are the knights after this Book of Darkness?

[Written by MAL Rewrite]"
82,Kidou Senshi Gundam 0080: Pocket no Naka no Sensou,"['action', 'drama', 'sci-fi']",2869,7.98,"Alfred Izuruha is a 10-year-old who lives in the neutral colony cluster of Side 6 and, like most boys his age, is obsessed with the war between the Earth Federation and the Principality of Zeon. Unbeknownst to him, Al's next-door neighbor, Christina, is the test pilot of a prototype Gundam being developed in secret by the Earth Federation in the colony. A Zeon Special Forces team is assembled and tasked with infiltrating the colony in order to either steal or destroy it.

When a skirmish breaks out between the Federation and infiltrating Zeon forces, the fascinated Alfred stumbles upon a Zaku mobile suit that has been shot down, piloted by Zeon rookie Bernard ""Bernie"" Wiseman. After this encounter, the two start a mutual friendship, so Alfred can learn more about the war that interests him so much, and Bernie can acquire inside information about the colony to aid his team's mission.

[Written by MAL Rewrite]"
83,Kidou Senshi Gundam: Dai 08 MS Shoutai - Miller's Report,"['drama', 'romance', 'sci-fi']",5769,6.75,"Shortly after being rescued off the Himalayas, Federation Ensign Shiro Amada is accused of espionage due to his encounter with Zeon's top-secret mobile armor. Intelligence officer Alice Miller is assigned to investigate on Shiro's whereabouts during his disappearance. Her documented findings will determine whether or not Shiro is a traitor, and what his fate will be as commander of the 08th MS Team.

(Source: ANN)"
84,Kidou Senshi Gundam 0083: Stardust Memory,"['action', 'adventure', 'drama', 'romance', 'sci-fi']",3352,7.22,"It is the year 0083 of the Universal Century. The rebellious Principality of Zeon has been defeated in the One Year War by the Earth Federation. However, a faction of Zeon remnants led by Aguille Delaz fled from the final battle, hiding themselves away. After three long years, they attempt to rise up once more, sending Delaz's ace pilot, Anavel Gato, to infiltrate a Federation research base to steal one of two secretly developed prototype Gundams along with its deadly nuclear warhead.

Threatened by the rogue Gundam suit and seeking to retain peace, the Earth Federation mobilizes the newly developed Albion carrier to recover the stolen unit. Manned by the remaining test pilots, with rookie pilot Kou Uraki piloting the remaining prototype Gundam, the Albion and her crew are determined to stop Gato, retake the stolen Gundam, and prevent the Zeon remnants from starting another war.

[Written by MAL Rewrite]"
85,Kidou Senshi Zeta Gundam,"['action', 'drama', 'romance', 'sci-fi']",2523,7.89,"It is Universal Century 0087, and the One Year War between the Earth Federation and Principality of Zeon is over. The Earth Federation has created an elite task force, known as the Titans, who are responsible for hunting the remaining Zeon forces. However, the power-hungry Titans have shown themselves to be no better than Zeon, spurring the creation of a rebellious faction called the Anti-Earth Union Group (AEUG).
 
17-year-old Kamille Bidan lives in the colony Green Noa, home to a Titan base. Kamille gets in trouble after assaulting a Titan officer, an event that coincides with an attack led by former Zeon ace Char Aznable, now known as AEUG pilot Quattro Bajeena. When Kamille steals a Titan's prototype Gundam, he soon finds himself in the middle of the dangerous conflict.

[Written by MAL Rewrite]"
86,Kidou Senshi Gundam ZZ,"['action', 'comedy', 'drama', 'sci-fi']",3421,6.66,"In Universal Century 0088, the Anti-Earth Union Group (AEUG) has emerged victorious in its war with the Earth Federation's Titans at the cost of devastating losses. Neo-Zeon, the third faction in the war formerly known as Axis Zeon, remains as powerful as ever. Led by Newtype Haman Karn, Neo-Zeon has been implementing plans to take over both Earth and the space colonies.

The AEUG flagship Argama heads to the Side 1 colony Shangri-La for repairs. Living in the colony is Judau Ashta, a 14-year-old junk dealer who is struggling to make enough money to put his younger sister through school. Upon the discovery of an escape pod containing a former Titans pilot, Judau and his friends are quickly led to the Argama in hopes of stealing a mobile suit which they can sell for a fortune. However, with the arrival of a Neo-Zeon ship seeking to defeat the Argama, Judau and his friends are dragged into to a conflict that will bring them across space and Earth.

[Written by MAL Rewrite]"
87,Kidou Senshi Gundam: Gyakushuu no Char,"['action', 'drama', 'sci-fi']",3160,7.67,"The year is Universal Century 0093. Char Aznable has taken command of Neo Zeon, the rebels of outer space. He firmly believes that humankind can only achieve peace by relocating to space. Thus, he plans to crash the giant asteroid Axis into Earth and plunge the planet into an uninhabitable winter. Char also eagerly anticipates this opportunity to settle a 14-year rivalry with Amuro Ray. The two have been reluctant allies at times, but Char has never forgiven Amuro for causing the death of one of his comrades during the One Year War.

Only the Earth Federation's Londo Bell Unit has the power to stop Char from fulfilling his dangerous goal. Leading the defense of Earth is veteran captain Bright Noa and Amuro Ray with the latest Nu Gundam mobile suit. In this thrilling conclusion to the original Gundam series, Londo Bell engages in a final conflict with Neo Zeon that will decide the fate of Earth and end this long-standing rivalry—once and for all.

[Written by MAL Rewrite]"
88,Kidou Senshi Gundam F91,"['action', 'drama', 'sci-fi']",3960,6.6,"In the year 123 of the Universal Century, skirmishes between the Federation government and the rebel group Crossbones Vanguard echo across Earth's space colonies. One of these small battles breaks in the hometown of young Seabook Arno, forcing him and his friends to flee and ensnaring them in the political turmoil that is quickly evolving into an all-out war.

Seabook meets Cecily Fairchild, granddaughter of the aristocrat Meitzer Ronah, who seeks to create a new political power called ""Cosmo Babylonia."" Using the Crossbone Vanguard as its muscle, the Ronah family schemes to restore aristocratic rule and establish an economic system that will benefit the nobility, thus devastating the quality of life for the common people of the Earth Sphere.

Seabook is tasked with piloting the Gundam F91, a mobile suit created by his mother, and must choose between protecting the Federation's status quo or cooperating with Cecily to find a better way of life for all.

[Written by MAL Rewrite]"
89,Kidou Senshi Victory Gundam,"['action', 'drama', 'sci-fi']",4249,6.71,"In the year 153 of the Universal Century, the tyrannical Zanscare Empire has taken hostile control over Side 2, a space colony outside of Earth's orbit. Following in the footsteps of the long expired Principality of Zeon and the more recent Crossbone Vanguard, Zanscare rules over its subjects with cruelty, routinely using a large guillotine for public executions.

Living in Central Europe, space immigrant Üso Ewin joins the League Militaire, a militia made up of civilians frustrated with the Earth Federation's inability to combat the Zanscare Empire. Üso's latent abilities as a psychic Newtype awaken and allow him to pilot the Victory Gundam, the only mobile suit capable of holding off the elite BESPA forces of the Zanscare Empire.

Hoping to protect his best friend Shakti Kareen and locate his parents within the ranks of the Federation, Üso fights on with the Victory, striving to bring an end to the empire's reign.

[Written by MAL Rewrite]"
91,Shin Kidou Senki Gundam Wing: Endless Waltz,"['action', 'award winning', 'drama', 'sci-fi']",3273,7.73,"In the year After Colony 196, one year after the conclusion of the intergalactic civil war, a state of stasis prevails over the Earth and its colonies. Seeing no further use for their Gundam mobile suits, war heroes Duo Maxwell, Heero Yuy, Trowa Barton, and Quatre Raberba Winner decide to destroy these weapons by launching them into the sun's surface. 

Before the Gundam reach their destination, the universal peace is shattered by the emergence of Mariemaia Khushrenada—the only child of the former tyrannical aristocrat Treize. Mariemaia abducts diplomat Relena Peacecraft and announces plans to launch ""Operation Meteor,"" with the intention of posthumously fulfilling Treize's world domination plot.

With the help of former enemy Zechs Marquise and his mobile suit Tallgeese, the heroic pilots must reacquire their mobile suits to wage one final battle against the Khushrenada dynasty, including fighting against their former ally Wufei Chang, now aligning himself with Mariemaia's ambitions.

[Written by MAL Rewrite]"
92,Kidou Shinseiki Gundam X,"['action', 'adventure', 'drama', 'sci-fi']",3793,7.33,"When one space colony declared its independence from the Earth Federation, the devastating 7th Space War, an all-out war between Earth and space, resulted. The Federation responded to the Space Revolutionary Army with mobile suits, called Gundams. However, the Space Revolutionary forces played their trump card and dropped hundreds of space colonies onto the Earth, plunging the planet into a seven-year-long nuclear winter. The Federation collapsed, but the Space Revolutionary Army was unable to invade the Earth in the aftermath of the colony drop.

Fifteen years have passed. The year is now After War 0015, and a New Federation has sprung up on Earth to restore order. In space, the colonial leaders have been rebuilding their own forces as well. By chance, fifteen-year-old Garrod Ran has discovered an old Federation mobile suit, the Gundam X, and now he uses it to help out the Vulture ship Freeden in its struggle to keep the powers that be from repeating the mistakes of the past."
95,Turn A Gundam,"['action', 'adventure', 'award winning', 'drama', 'romance', 'sci-fi']",3218,7.78,"It is the Correct Century, two millennia after a devastating conflict which left the world broken. Earth is now mostly uninhabitable, and thus a remnant of humanity has resided on the Moon while the Earth and its few survivors recover. For years, the ""Moonrace,"" the people of the Moon, have continued to check if Earth is fit for resettlement.

A boy named Loran Cehack and two others are sent down to Earth for a reconnaissance mission. Loran ends up spending a year on the planet working for the Heim Family, aristocrats living in a Victorian-like society. This family, like others of similar wealthy status, celebrates one's coming of age with a ceremony involving a giant stone statue known as the ""White Doll.""

To Loran's surprise, the Moonrace suddenly touches down on Earth with the intent of taking it by force. During the attack, the White Doll is broken apart, revealing a mobile suit called the ""Turn A Gundam"" inside. With Loran in its cockpit, the Turn A causes a standoff between the forces of Earth and Moon. The young pilot, along with the people of both sides, must keep the peace and avoid another all-out, catastrophic war.

[Written by MAL Rewrite]"
96,Kidou Butouden G Gundam,"['action', 'drama', 'romance', 'sci-fi']",2676,7.58,"In the year Future Century 0060, the many countries that once comprised Earth's surface exist as separate colonies floating in space. Their home planet now uninhabitable, the ruler of all of the colonies is decided by their unanimous participation in the intergalactic Gundam Fight Tournament—a series of battles between the champions of each colony to determine who is most fit to reign over them all.

Neo-Japan's champion is Domon Kasshu, a man who accepts the role with some ulterior motives. Domon searches the galaxy for his brother, a criminal who allegedly murdered their mother and made off with the Devil Gundam, a highly advanced weapon with the power to unleash mass destruction across the galaxy. In his quest to bring his sibling to justice, Domon travels from colony to colony, meeting many of the fighters who will become his allies and enemies in the forthcoming Gundam Fight Tournament.

Armed with the strength of the Shining Gundam, Domon battles to uncover the truth behind his tortured childhood, suffering great betrayal and crushing blows on his quest toward personal and national triumph.

[Written by MAL Rewrite]"
99,Mai-Otome,"['comedy', 'drama', 'fantasy']",3175,7.27,"In the Kingdom of Windbloom, Arika Yumemiya enrolls at Garderobe Academy to become an Otome—a virgin girl who is able to use a HiME (Highly-advanced Materializing Equipment) that bestows destructive abilities. Arika also wishes to find her mother who was a Meister Otome, an Otome of the highest rank responsible for being the personal bodyguard and super weapon of the specific nation they are assigned to.

While attending the academy, Arika makes friends with Nina Wáng, a distinguished Otome student, and Mashiro Blan de Windbloom, the current princess of the kingdom. With them by her side, Arika quickly adjusts to the academy's environment as she spends her days eagerly training, navigating social relationships, and developing her skills as an Otome.

However, Arika soon realizes that the process of becoming an Otome is fraught with dangers and unsavory political dealings. Bombarded with numerous personal dilemmas, Arika must make many sacrifices if she truly wishes to achieve her goals.

[Written by MAL Rewrite]"
100,Shin Shirayuki-hime Densetsu Prétear,"['drama', 'romance']",2809,7.16,"Due to her father's remarriage, robust 16-year-old Himeno Awayuki moves into a large mansion with a beautiful garden—the quintessential dream house for any girl her age. However, much to Himeno's disappointment, her new stepfamily doesn't really seem to like her, as her stepmother often occupies herself with her father, her younger stepsister Mawata ignores her, and her other stepsister—the equally aged Mayune—tries to prank her at every opportunity.

But Himeno doesn't have time to dwell into thoughts of hopelessness—her new life has now become involved with a group of seven magical boys known as the Leafe Knights, after they ask her to become a magical princess who can borrow their powers! Although Himeno accepts their request and becomes the Prétear, she feels doubtful in her abilities to protect the world and its Leafe, the source of energy for all life. Will Himeno be able to find happiness among her new family and also save the Earth from the enemy, the Princess of Disaster?

[Written by MAL Rewrite]"
