id,title,genres,popularity,rating,description
158,Maria-sama ga Miteru,"['Drama', 'Girls Love']",2650,7.28,"When Yumi Fukuzawa entered the Lillian Girls' Academy, a prestigious all-girls Catholic school in Tokyo, she never imagined she would catch the eye of beautiful and demure Sachiko Ogasawara, one of the school's most popular students. Now Sachiko has offered to be Yumi's soeur, her ""sister"" and guide for all her years at the academy. The whole idea has Yumi completely flustered—after all, they hardly know each other!

The entire campus is abuzz with rumors about the two of them, but Yumi is conflicted over accepting Sachiko's offer. While she admires Sachiko, being her soeur would also mean constantly being at the center of the entire school's attention!

(Source: RightStuf)"
159,Boukyaku no Senritsu,"['Action', 'Adventure', 'Fantasy', 'Horror', 'Sci-Fi']",5085,6.26,"A great war occurred in the 20th century between humans and monsters. Since that time, the monsters rule the world in fear but keep relatively hidden from public view. A boy named Bokka ponders the past and wonders what became of the Meros Warriors who defended the world so bravely against the demons. He soon meets Kurofune and learns of the power of the Meros and the I-bar machines they ride in battle. Warriors are the only ones who can see and hear the Melody of Oblivion, a phantom girl hidden away waiting to be rescued and be the savior of mankind. During a battle between Kurofune and a demon, Bokka discovers something only his wildest dreams could possibly imagine...he too can hear that melody. Throughout his journeys, Bokka meets many monsters and their agents, friends, and companions as he discovers the true extent of his new powers. He must continue to battle evil in the hope of releasing Boukyaku no Senritsu and free a world that has forgotten its once beautiful melody.

(Source: ANN)"
160,"Ima, Soko ni Iru Boku","['Adventure', 'Drama', 'Fantasy', 'Sci-Fi']",1605,7.58,"Shuuzou ""Shuu"" Matsutani lives his ordinary life in peace. He has friends, a crush, and a passion for kendo. Dejected after losing to his kendo rival, Shuu climbs a smokestack to watch the sunset where he finds Lala-Ru, a quiet, blue-haired girl wearing a strange pendant. Shuu attempts to befriend her, despite her uninterested, bland responses.

However, his hopes are crushed when a woman, accompanied by two serpentine machines, appear out of thin air with one goal in mind: capture Lala-Ru. Shuu, bull-headed as he is, tries to save his new friend from her kidnappers and is transported to a desert world, unlike anything he has ever seen before. Yet, despite the circumstances, Shuu only thinks of saving Lala-Ru, until he is thoroughly beaten up by some soldiers. As he soon finds out, Lala-Ru can manipulate water and her pendant is the source from which she is able to bring forth the liquid, a scarce commodity in his new environment. But now, the pendant is lost, and Shuu is the prime suspect.

Ima, Soko ni Iru Boku is the haunting story of a dystopian world, and of Shuu, who has to endure torture, hunger, and the horrors of war in order to save the lonely girl he found sitting atop a smokestack.

[Written by MAL Rewrite]"
161,Peace Maker Kurogane,"['Action', 'Comedy']",2979,7.29,"Although traumatized by witnessing the murder of his parents by one of the Choushuu, Ichimura Tetsunosuke's thirst for revenge lead him to desire strength. At the age of 15, Tetsunosuke approached the Shinsengumi, wanting to become one of its members. However, Tetsunosuke lacked the skill, mind and will to emotionlessly cut down whoever threatened peace and the Shinsengumi. Even with the support of his brother Tatsunosuke and his newfound friends of the Shinsengumi, little did Tetsunosuke know the blood and pain he would have to face being part of this historical group."
162,Pita Ten,"['Comedy', 'Fantasy', 'Romance']",4620,6.91,"Kotarou was pretty much supposed to be your average boy, worried about the pressures of education while enjoying a simple life with his friends. Much to his despair, he one day finds the overly cheerful Misha at his door, asking to be friends out of nowhere. Even more shocking is that Misha is an apprentice angel, yet she does more bad then good. Along with Kotarou's school friends Takashi and Koboshi and the so called devil Shia (once again being able to do more good then bad), the group of friends spend their days getting into all sorts of adventures and troubles."
163,Power Stone,"['Adventure', 'Comedy', 'Fantasy']",7022,6.46,"An ancient legend tells of a magical Powerstone that granted its owner any wish desired. Adventurers from all over the globe clash as they seek this mystical gem. 

Based upon the Dreamcast game, POWERSTONE tries to entertain us with the story behind the game's premise. The plot begins with our hero, Fokker, training to be a fighter like his idol, Vargas. 

(Source: AniDB)"
164,Mononoke Hime,"['Action', 'Adventure', 'Award Winning', 'Fantasy']",106,8.66,"When an Emishi village is attacked by a fierce demon boar, the young prince Ashitaka puts his life at stake to defend his tribe. With its dying breath, the beast curses the prince's arm, granting him demonic powers while gradually siphoning his life away. Instructed by the village elders to travel westward for a cure, Ashitaka arrives at Tatara, the Iron Town, where he finds himself embroiled in a fierce conflict: Lady Eboshi of Tatara, promoting constant deforestation, stands against Princess San and the sacred spirits of the forest, who are furious at the destruction brought by the humans. As the opposing forces of nature and mankind begin to clash in a desperate struggle for survival, Ashitaka attempts to seek harmony between the two, all the while battling the latent demon inside of him. Princess Mononoke is a tale depicting the connection of technology and nature, while showing the path to harmony that could be achieved by mutual acceptance.

[Written by MAL Rewrite]"
165,RahXephon,"['Action', 'Award Winning', 'Drama', 'Mystery', 'Romance', 'Sci-Fi', 'Suspense']",1893,7.37,"The ordinary life of high school student Ayato Kamina is turned upside down when Tokyo is suddenly invaded by futuristic fighter jets. Amidst the chaos, he encounters a woman called Haruka Shitow who claims to be from a government organization called TERRA. She reveals that he has been living in a time bubble named ""Tokyo Jupiter"" that was put in place by the Mulians—humanoids from another dimension—in an attempt to isolate and take over Tokyo. TERRA has been trying to break through the barrier surrounding the city ever since. 

Unable to process the revelation, Ayato panics and flees. He runs into his classmate Reika Mishima who leads him to a place called ""The Shrine of Xephon"" where a large egg slumbers. She starts to sing and an unknown power awakens within Ayato, connecting him to a being called RahXephon that breaks out of the egg. Shortly after, Haruka finds him again and tries to make him join her cause of fighting against the Mulians.

Caught between the crosshairs of the Mulians and TERRA, Ayato begins to question his purpose, navigating altered memories and ultimately his very identity in this chaotic new world.

[Written by MAL Rewrite]"
166,Samurai 7,"['Action', 'Sci-Fi']",1763,7.43,"In the far distant future, on a planet that might have been called ""earth"", there was a war between samurai who mechanized their bodies. After the long war, people enjoyed a modest peace.

Facing starvation and abductions at the hands of fearsome mechanized bandits (Nobuseri), the farmers of Kanna Village make the dangerous choice to hire samurai for protection. The village's water priestess, Kirara, her younger sister, Komachi, and a heartbroken villager, Rikichi, set off to hire willing samurai with nothing to offer but rice from their meager harvests. Through dangerous encounters and a bit of luck, seven samurai of varying specialties and experience are gathered for an epic battle against the bandits and the merchants that influence them.

Samurai 7 is based loosely upon Kurosawa Akira's famous movie ""Seven Samurai""/""Shichinin no Samurai"""
167,Scrapped Princess,"['Action', 'Adventure', 'Drama', 'Fantasy', 'Sci-Fi']",2207,7.37,"Born to the royal family, Pacifica Casull has earned the nickname ""Scrapped Princess"" after an apocalyptic prophecy foretells her destroying the world on her 16th birthday. Rescued from certain death by a kindly family, she takes shelter with her adoptive older brother and sister, Shannon and Raquel Casull. When news of her survival reaches the ears of the God Mauser's worshippers, they issue her death at all costs, forcing Pacifica to flee for her life.

Plagued by threats from the church, the nobility and even the common people, the three siblings attempt to outrun the fate Pacifica is destined to bring, all the while questioning if one girl's life is worth the world's demise. The true nature of the Scrapped Princess, along with the harrowing revelations of the world itself, becomes more and more apparent as the princess' 16th birthday fast approaches.

[Written by MAL Rewrite]"
168,s.CRY.ed,"['Action', 'Adventure', 'Drama', 'Sci-Fi']",2413,7.36,"A strange environmental phenomenon 22 years ago in the Kanazawa prefecture caused the land to split and protrude upwards reaching unprecedented heights, creating the secluded area known as The Lost Ground. Kazuma is a young mercenary who lives in the Lost Ground, looking for any work he can find to sustain his livelihood within the harsh environment. He is one of the few people that are gifted with the Alter ability, which allows him to plaster his right arm and torso with a metallic alloy. When this mercenary encounters HOLY, an order whose purpose is to suppress and capture what they call Native Alter Users, and one of the elite members of HOLY, Ryuho, an epic rivalry begins.

(Source: ANN)"
169,Shingetsutan Tsukihime,"['Action', 'Horror', 'Mystery', 'Romance', 'Supernatural']",1422,6.79,"Shiki Toono wakes up in a hospital ward with the ability to see invisible lines. These thin threads, which make up all matter in Shingetsutan, instantly destroy an object when severed. Shiki discovers that if he traces the lines of something, its destruction soon follows. While keeping his supernatural vision a secret, Shiki proceeds to live his sophomore life in peace. However, this peace is short-lived when Shiki encounters a mysterious woman with bright red eyes on his way back from school. Following a sudden psychotic lapse, he appears to kill the woman, and passes out shortly after. As if things couldn't get any worse, Shiki is assailed by a pair of demonic hounds the next day—facing certain death, Shiki is saved by the timely arrival of the same woman from yesterday. She introduces herself as Arcueid Brunestud, a vampire princess. Deciding to team up, Shiki and Arcueid embark on a journey to uncover the truth behind their lineage and the recent string of murders around town.

[Written by MAL Rewrite]"
170,Slam Dunk,['Sports'],810,8.55,"Hanamichi Sakuragi, infamous for his temper, massive height, and fire-red hair, enrolls in Shohoku High, hoping to finally get a girlfriend and break his record of being rejected 50 consecutive times in middle school. His notoriety precedes him, however, leading to him being avoided by most students. Soon, after certain events, Hanamichi is left with two unwavering thoughts: ""I hate basketball,"" and ""I desperately need a girlfriend.""

One day, a girl named Haruko Akagi approaches him without any knowledge of his troublemaking ways and asks him if he likes basketball. Hanamichi immediately falls head over heels in love with her, blurting out a fervent affirmative. She then leads him to the gymnasium, where she asks him if he can do a slam dunk. In an attempt to impress Haruko, he makes the leap, but overshoots, instead slamming his head straight into the blackboard. When Haruko informs the basketball team's captain of Hanamichi's near-inhuman physical capabilities, he slowly finds himself drawn into the camaraderie and competition of the sport he had previously held resentment for.

[Written by MAL Rewrite]"
171,Strange Dawn,"['Adventure', 'Drama', 'Fantasy']",7885,6.25,"Yuko and Eri are two normal girls who are sucked into the alternate world filled with tiny people. The people of this mysterious world sees them as their ""Great Protectors"" who can protect their land in a time of strife. The two girls set out on a mission with a group of warriors from the village to find out how they were brought here and how might they return home. However, there is a war brewing and these two Great Protectors are the political tool that every faction lusts for to rally the people to their side. 

(Source: ANN)"
173,Tactics,"['Mystery', 'Supernatural']",3593,7.18,"Ichinomiya Kantarou grew up with the ability to see demons, but was isolated and bullied by others who did not share the same gift. Instead, he became being friends with the demons, gaining a great attachment to their existence. One day, Kantarou was told about the strongest demon, the one known as the ogre-eating Tengu. Amazed by the news of his strength, Kantarou vowed to find this demon who was far stronger than any other, deciding to call him Haruka when he did so. Since this time, Kantarou searched far and wide for the ogre-eating Tengu with no luck, making his living by becoming a folklore writer and demon-buster. On a particular job, Kantarou had finally found news of a nearby shrine supposedly the place where the ogre-eating Tengu was sealed."
174,Tenjou Tenge,"['Action', 'Drama', 'Supernatural', 'Ecchi']",1301,6.86,"For some people, high school represents the opportunity for a fresh start. You can take new classes and make new friends. For Souichiro Nagi and Bob Makihara, though, high school means something different: the chance to become the top fighters in the entire student body! Too bad Toudou Academy is the hardest possible place to realize their dreams. Their new high school is no ordinary academic institution. Rather than concentrating on classic subjects like math and science, Toudou Academy was created for the sole purpose of reviving the martial arts in Japan!

As a result, Souichiro's aspirations to become top dog are cut short when he runs afoul of Masataka Takayanagi and Maya Natsume. The two upperclassmen easily stop the freshmen duo's rampage across school, but rather than serving as a deterrent, it only stokes their competitive fire. What kind of monstrous fighters attend Toudou Academy? Are there any stronger than Masataka and Maya? And why in the world is Maya's younger sister stalking Souichiro? Learn the answers to these questions and more in Tenjou Tenge!"
175,Tokyo Underground,"['Action', 'Adventure', 'Romance', 'Sci-Fi']",4184,6.58,"Under the capital city of Tokyo, Japan, there exists a large, vast, and unknown world known as Underground. There, people known as Elemental Users exist; people who have the ability to control the elements: Fire, Water, Lightning, Magnetism, Freeze, etc. Meet Rumina Asagi and his best friend Ginnosuke Isuzu, two average high school freshmen who reside in Tokyo. When they meet Gravity User, Chelsea Rorec, and the Miko of Life, Ruri Sarasa, their whole lives change into one big adventure.

(Source: ANN)"
176,Triangle Heart: Sweet Songs Forever,"['Adventure', 'Romance']",7451,6.11,"Fiasse is a world-renowned singer. She is now the headmistress of a special Singing School who does a Charity World Tour every year. Her mother left behind a inheritance for her after she died and some shady people are after Fiasse and the inheritance. Bring in Ellis, and two siblings who are master of the swords to protect Fiasse. The World Tour is coming up and Fiasse will continue the show. Ellis, Kyoya, Miyuki and company must protect their childhood friend at all costs. 

(Source: ANN)"
177,Tsubasa Chronicle,"['Action', 'Adventure', 'Fantasy', 'Romance']",1096,7.51,"Sakura and Syaoran live peaceful lives in the desert country of Clow. Despite the King's disapproval of the budding romance between the princess and her archeologist friend, their days remain blissful if not a little dull. But that soon changes when Sakura appears in front of Syaoran in a trance with wings on her back. When the wings dissolve into feathers and Sakura loses consciousness, Syaoran is spurred to action.

Syaoran soon learns that he must collect Sakura's feathers, which have been scattered across many different realms, in order to protect her life. After making a deal with the Dimensional Witch Yuuko Ichihara, Syaoran teams up with Mokona Modoki, a creature who has the power to traverse realms. Also accompanying him on this journey are Fai D. Flourite, a carefree man fleeing persecution in his home world, and Kurogane, a swordsman forced to travel to refine his strength and character. Together, the bizarre alliance works to reclaim Sakura's feathers—no matter how impossible it seems to find them all.

[Written by MAL Rewrite]"
178,Ultra Maniac,"['Comedy', 'Fantasy', 'Romance']",3932,7.15,"Fantasies and miracles never interested Ayu Tateishi, a popular second-year student at her middle school. She was content with preserving her image of being cool, calm, and collected—all to catch the eye of her crush, Tetsushi Kaji. Ayu's carefree youthful days are interrupted by the appearance of Nina Sakura, a new transfer student who turns out to be a witch. As the only person who knows about Nina's ability to cast spells using a mini-computer, Ayu is forced to help Nina with her mission to find the five Holy Stones, qualifying her to marry the prince of the Magic Kingdom.

Unfortunately, Nina's ineptitude with magic and her habit of meddling in Ayu's personal life cause nothing but trouble for the two of them as Ayu toils to maintain her good reputation and Nina struggles to hide her secret from the discerning eye of Hiroki Tsujiai, Tetsushi's best friend and an avid fan of manga. And when Nina's search for the five Holy Stones brings allies and challengers from the Magic Kingdom, Ayu is dragged into a world she never even dreamed was possible.

[Written by MAL Rewrite]"
179,Ultra Maniac OVA,"['Comedy', 'Fantasy', 'Romance']",8277,6.62,"Ayu Tateishi is a popular second-year student at her middle school admired for being calm, cool, and collected. But this carefully preserved image was all crafted to catch the eye of her crush Tetsushi Kaji, who once complimented her for those qualities. Studying, playing tennis, and finding chances to speak with Tetsushi are all that are on Ayu's mind—until the day she finds a mini-computer underneath a bench. 

After returning the item to Nina Sakura, a girl who was searching for a lost item earlier, Ayu is chosen by Nina as a confidante for her secret. When the school's two tennis teams have a dispute regarding use of the courts, Ayu is forced to settle the matter by playing against Hiroki Tsujiai, the captain of the boys' team and Tetsushi's best friend. While dreading the prospect of losing and embarrassing herself, Ayu is approached by Nina, who is revealed to be a witch who came to Earth after failing to graduate from the Magic Kingdom's middle school. Wanting to help Ayu win the match, Nina imbues a piece of chocolate with a spell that just might come in handy...

[Written by MAL Rewrite]"
180,Vandread,"['Action', 'Sci-Fi', 'Ecchi']",2364,7.15,"In Vandread, men are from Mars and women are from Venus! Well, not quite. Technology has allowed mankind to colonize the entire Milky Way galaxy, and in one star system, the men and women live on two different planets, Taraak and Mejere. A bitter and very literal gender war rages, to the point where they don't even see each other as the sames species anymore!

Hibiki Tokai, a male third-class laborer from Taraak, ends up stuck on a battleship after a botched attempt at stealing a robot. When female pirates capture the Taraakian Vanguard, things don't look like they could get any worse for Hibiki. Unfortunately, they do; when the male crew of the Vanguard fire on their captured vessel out of desperation, they created a giant wormhole, which sucks the Vanguard and the Mejeran pirate's ships into itself! Now, stuck far away from their home planets, these men and women must learn to work together if they ever wish to make it back home."
181,Vandread: The Second Stage,"['Action', 'Sci-Fi', 'Ecchi']",3083,7.38,"Though Hibiki and crew defeated a super-huge battleship of the earth in the last of the first stage, they noticed five battleships further aiming at Mejeiru and Tarahk. And, crew of NIRVANA learnt Tarahk and Mejeiru which were their home had been faced to the crisis of Karitori (reaping). Travel to their home is speed up so that they may inform of the crisis. On the way, current information of the earth having been brought by girl Misty who had come to travel with them was worse than they can imagine. Hibiki and crew noticed a true fight was in the future. VANDREAD is finally changed into final system by the attack of the enemy who becomes violent more and more. Can they save their home? And, what happens to the relations between Hibiki and Dita?

(Source: AnimeNfo)"
182,Tenkuu no Escaflowne,"['Action', 'Adventure', 'Fantasy', 'Romance', 'Suspense']",1492,7.66,"Hitomi Kanzaki is just an ordinary 15-year-old schoolgirl with an interest in tarot cards and fortune telling, but one night, a boy named Van Fanel suddenly appears from the sky along with a vicious dragon. Thanks to a premonition from Hitomi, Van successfully kills the dragon, but a pillar of light appears and envelopes them both. As a result, Hitomi finds herself transported to the world of Gaea, a mysterious land where the Earth hangs in the sky.

In this new land, Hitomi soon discovers that Van is a prince of the Kingdom of Fanelia, which soon falls under attack by the evil empire of Zaibach. In an attempt to fight them off, Van boards his family's ancient guymelef Escaflowne—a mechanized battle suit—but fails to defeat them, and Fanelia ends up destroyed. Now on the run, Hitomi and Van encounter a handsome Asturian knight named Allen Schezar, whom Hitomi is shocked to find looks exactly like her crush from Earth. With some new allies on their side, Van and Hitomi fight back against the forces of Zaibach as the empire strives to revive an ancient power.

[Written by MAL Rewrite]"
183,Whistle!,['Sports'],5587,7.36,"Kazamatsuri Shou's dream has always been to become a professional soccer player, but he has one problem: he's not very good at the game. He was accepted to the prestigious Musashi no Mori Junior High, known for its top rate soccer team, but he was never able to rise beyond the rank of third stringer. After transferring to Sakura Jousui Junior High, he can finally play soccer. And, with the support of his new friends and teammates, his strong determination, and lots of hard work, his soccer skills are developing rapidly and setting Shou well on his way to achieving his dream.

(Source: ANN)"
184,Xenosaga The Animation,"['Action', 'Sci-Fi']",4916,6.32,"The year is T.C. 4767. Four thousand years have passed since humanity abandoned its birthplace, the planet Earth. Beset by the hostile alien Gnosis, mankind is now scrambling to find ways to defeat this threat to their existence. The development of KOS-MOS (a specialized android with amazing capabilities) by Vector engineer Shion Uzuki was one response to the threat. But when their ship is destroyed by the Gnosis, Shion and her companions find themselves thrust into the middle of a battle with no clear sides...

(Source: Anime-Planet)"
185,Initial D First Stage,"['Action', 'Drama']",606,8.35,"Unlike his friends, Takumi Fujiwara is not particularly interested in cars, with little to no knowledge about the world of car enthusiasts and street racers. The son of a tofu shop owner, he is tasked to deliver tofu every morning without fail, driving along the mountain of Akina. Thus, conversations regarding cars or driving in general would only remind Takumi of the tiring daily routine forced upon him.

One night, the Akagi Red Suns, an infamous team of street racers, visit the town of Akina to challenge the local mountain pass. Led by their two aces, Ryousuke and Keisuke Takahashi, the Red Suns plan to conquer every racing course in Kanto, establishing themselves as the fastest crew in the region. However, much to their disbelief, one of their aces is overtaken by an old Toyota AE86 during a drive back home from Akina. After the incident, the Takahashi brothers are cautious of a mysterious driver geared with remarkable technique and experience in the local roads—the AE86 of Mount Akina.

[Written by MAL Rewrite]"
186,Initial D Second Stage,"['Action', 'Drama']",1109,8.18,"Accumulating an impressive series of victories with his AE86, Takumi Fujiwara has imposed himself as street racing's newest rising star. However, his newly found confidence of winning at his home turf of Mount Akina has been put in jeopardy by a new Emperor team exclusively using a car model favored by most professional racing pilots: the Mitsubishi four-wheel drive Lancer Evolutions—also known as Lan Evos. The Emperor team leader, Kyouichi Sudou, looks down on Takumi and regards him as an inferior pilot for driving an antique car that lacks the makings of a true modern race car. Kyouichi's elitist philosophy is also the reason why his team is only made of Lan Evo drivers.

Will Takumi be able to keep his perfect track record intact against the highly skilled and mechanically superior Emperor team, or does his hot streak end here?

[Written by MAL Rewrite]"
