id,title,genres,popularity,rating,description
126,Futakoi Alternative,"['Comedy', 'Drama', 'Romance']",4096,6.84,"The Futaba Detective Agency, being run by Rentarou, who has taken over the family business, after his father's death 3 weeks ago. Along with Sara &amp; Souju, his live-in identical twin assistants. He ends up running afoul of the local Yakuza.

(Source: ANN)"
127,Gate Keepers,"['Action', 'Comedy', 'Fantasy', 'Sci-Fi']",4754,6.91,"Technology, science, and industry—this is 1969 Tokyo, and there is no better time to be alive! But a shadow looms quietly around every corner: ""Invaders"" have infiltrated the populace, and nobody knows who or what they are.

Only the members of the top-secret agency AEGIS know of their existence. Covertly fighting the enemy is their job, but only those with the ability to open ""Gates"" to another world can truly defeat them. Within AEGIS is a specialized task force known as the ""Gate Keepers."" Composed of extraordinary individuals with a variety of Gate-related abilities, they are the only ones who can save humanity from the vicious Invaders plaguing the planet.

Shun Ukiya is an average high school student who lives with his widowed mother and little sister. While on his way home from school one day, he comes across a group of Invaders heading toward his house. In a desperate plight to save his family, Shun discovers he possesses the ability to open a Gate, allowing him to harness massive amounts of energy. With his newfound ability exposed, he catches the attention of AEGIS, and particularly the interest of one of its Gate Keepers, Shun's childhood friend Ruriko Ikusawa.

[Written by MAL Rewrite]"
128,Gate Keepers 21,"['Action', 'Drama', 'Sci-Fi']",6335,6.74,"Thirty-two years have passed since the initial defeat of the Invaders. A.E.G.I.S is all but dismantled now and has become an underground organization consisting of only a few Gate Keepers left to save humanity. One of the members, Ayane Isuzu, is sick of society as a whole, though she continues to defeat the Invaders out of spite for her father. Suddenly, she learns of the revival of Machine General (Kikai Shogun) and Devil Count (Akuma Hakushaku), but a mysterious ghost girl now accompanies them. It is up to Ayane and the remnants of A.E.G.I.S to stop them and save humanity once again.

(Source: ANN)"
129,Gensoumaden Saiyuuki,"['Action', 'Adventure', 'Drama', 'Fantasy']",3044,7.54,"Many years ago, humans and demons lived in harmony. But that unity ended when demons started attacking humans and plotted a mission to unleash Gyumao—an evil demon imprisoned for thousands of years. Now, Genjo Sanzo, a rogue priest, must team up with three demons—Sha Gojyo, Son Goku, and Cho Hakkai—and embark on a perilous journey to the west to stop these demons from resurrecting Gyumao and restore the balance between humans and demons on Earth.

(Source: ANN)"
130,Saiyuuki Reload,"['Action', 'Adventure', 'Comedy', 'Drama', 'Supernatural']",3842,7.36,"Priest Genjo Sanzo and companions Cho Hakkai, Sha Gojyo, and Son Goku maintain their westward journey to stop the resurrection of the demon Gyoumao. As the reputation of the Sanzo Ikkou precedes them, they continue to fight demon assassins at every turn, but they must also deal with increasing tensions within their group in order to defeat a powerful enemy. 

(Source: ANN)"
131,Saiyuuki Reload Gunlock,"['Action', 'Adventure', 'Comedy', 'Drama', 'Supernatural']",4653,7.37,"The Sanzo Ikkou continues its westward journey, on a mission to prevent a demonic resurrection. As Genjo Sanzo, Cho Hakkai, Sha Gojyo, and Son Goku fight their way to their goal, their path is fraught with internal strife. When they encounter a formidable pair of adversaries from the west, the cohesion of the group -- and the fate of the mission -- may be at stake. 

(Source: ANN)"
132,GetBackers,"['Action', 'Mystery', 'Supernatural']",1864,7.57,"Mido Ban and Amano Ginji are known as the Get Backers, retrievers with a success rate of 100%. Whatever is lost or stolen, they can definitely get it back. Despite their powerful abilities and enthusiastic behavior, Ban and Ginji are terminally broke no matter what they do simply because few people would actually desire to hire them. As a result, the pair of them tend to do dangerous jobs, often leading to unwanted re-encounters with their old (and dangerous) friends."
133,Green Green,"['Comedy', 'Romance', 'Ecchi']",1921,6.13,"Kanenone Gakuen is an all-male boarding school located in the countryside of Japan. Although an all-male school is nothing new, life can become quite difficult when there are no female students for miles around. In order to help the psychological health of everyone involved, the school board has decided to try and merge with the nearest all-girl boarding school in order to become co-ed. The boys of Kanenone are more than thrilled at the prospect, and the girls are curious as to how interesting school life might become if there were more boys around. Before any serious decisions are made, the girls have been invited to stay at Kanenone for one month as a test.

Green Green follows Yuusuke Takazaki and his naughty room mates called the Baka (Idiot) Trio, and their ability to talk to the girls without making complete fools of themselves. But as soon as the school bus with the girls arrives, things become weird, hormonal, and hysterical. In particular, a girl named Midori Chitose leaps off the bus and immediately embraces a very confused Yuusuke. Is he a natural ladies' man, or do the two of them have a shared history that he is not aware of?"
134,Gunslinger Girl,"['Action', 'Drama', 'Sci-Fi', 'Suspense']",1288,7.38,"In the heart of Italy, the Social Welfare Agency rescues young girls from hospital beds and gives them a second chance at life using the latest in cybernetic advancements. With their artificially enhanced bodies, the girls are brainwashed and trained as assassins to carry out the dirty work of the Italian Government. Despite all the modifications, they are still just children at heart, struggling for recognition from those they love, even knowing the love they feel is manufactured. This tragic tale unfolds as these girls grapple with their emotions in an agency that treats them as nothing but ruthless killers.

[Written by MAL Rewrite]"
135,Hikaru no Go,"['Comedy', 'Drama', 'Supernatural']",1682,8.07,"While searching through his grandfather's attic, Hikaru Shindou stumbles upon an old go board. Touching it, he is greeted by a mysterious voice, and soon after falls unconscious. When he regains his senses, he discovers that the voice is still present and belongs to Fujiwara no Sai, the spirit of an ancient go expert. A go instructor for the Japanese Emperor in the Heian Era, Sai's passion for the game transcends time and space, allowing him to continue playing his beloved game as a ghostly entity. Sai's ultimate goal is to master a divine go technique that no player has achieved so far, and he seeks to accomplish this by playing the board game through Hikaru.

Despite having no interest in board games, Hikaru reluctantly agrees to play, executing moves as instructed by Sai. However, when he encounters the young go prodigy Akira Touya, a passion for the game is slowly ignited within him. Inspired by his newfound rival, Hikaru's journey into the world of go is just beginning.

[Written by MAL Rewrite]"
136,Hunter x Hunter,"['Action', 'Adventure', 'Fantasy']",375,8.42,"Hunters are specialized in a wide variety of fields, ranging from treasure hunting to cooking. They have access to otherwise unavailable funds and information that allow them to pursue their dreams and interests. However, being a hunter is a special privilege, only attained by taking a deadly exam with an extremely low success rate.

Gon Freecss, a 12-year-old boy with the hope of finding his missing father, sets out on a quest to take the Hunter Exam. Along the way, he picks up three companions who also aim to take the dangerous test: the revenge-seeking Kurapika, aspiring doctor Leorio Paladiknight, and a mischievous child the same age as Gon, Killua Zoldyck.

As the four aspiring hunters embark on a perilous adventure, they fight for their dreams while defying the odds.

[Written by MAL Rewrite]"
137,Hunter x Hunter: Original Video Animation,"['Action', 'Adventure', 'Fantasy']",1802,8.31,"After reuniting with Gon and his friends, Kurapika explained to them the risks he bears because of his abilities. Believing that his target of revenge is no longer alive and the search for his fallen comrade's eyes could truly begin, Kurapika soon after receives a message informing him that all the Spiders still lived. After much discussion between his friends, Gon, Kurapika and company decided to hunt after the one Spider member who's ability could ultimately result in Kurapika's defeat and death. Based on the manga by Togashi Yoshihiro."
138,Hunter x Hunter: Greed Island,"['Action', 'Adventure', 'Fantasy']",1527,8.18,"After the battle with the Spiders, the search for Ging continues as Gon and Killua decided to once again attempt to purchase the rare game ""Greed Island."" However, Gon came up with a better plan, which was to volunteer to complete the game for the billionaire who owned it. But some training must be done, as Gon and Killua's abilities are still at a developing stage and ""Greed Island"" is no simple game for anyone to play with. It is the infamous game that could easily lead to one's death. Based on the manga by Togashi Yoshihiro."
139,Hunter x Hunter: Greed Island Final,"['Action', 'Adventure', 'Fantasy']",1626,8.25,"Continuing with their adventure at Greed Island, Gon and Killua train furiously under the guidance of Biscuit for better preparation at attempting the game. With their abilities vastly improving and the threat of player killers menacing Greed Island, Gon and company continue the game despite the dangers that they will face with the game activities and encounters with other players. Based on the manga by Togashi Yoshihiro."
141,Jinki:Extend,['Sci-Fi'],6069,6.05,"Aoba is a young girl who loves to build models of robots. She lived alone with her grandmother until her grandmother passes away. Shortly after she is kidnapped and brought to a secret base where she discovers a huge robot. The piloted robots fight against Ancient-Jinki in The Grand Savanna, but the true meaning behind the fights is hidden. Aoba works hard at the base so one day she can pilot one of the robots and discover these secrets."
142,Kamikaze Kaitou Jeanne,"['Action', 'Drama', 'Mystery', 'Romance', 'Supernatural']",3000,7.46,"A normal looking high school girl on the outside, Kusakabe Maron is actually the reincarnation of Jeanne d' Arc. With the help of the angel, Fin Fish, Maron works as the thief Jeanne at night to seal the demons that reside in pieces of artwork, preying upon the weak hearts of the owners. She is branded as a thief due to the fact that the artworks disappear after she seals the demons. One day, a new neighbor and classmate appears, as well as a rival in her night job, the thief Sinbad. With her own best friend being the detective's daughter, out to capture her and the appearance of her new rival, Maron's work is anything but easy."
143,Kannazuki no Miko,"['Drama', 'Girls Love', 'Supernatural']",2633,6.8,"Kannazuki no Miko begins in the village of Mahoroba, where time passes slowly for both man and nature. Two students from the village's prestigious Ototachibana Academy might as well be night and day. Himeko is shy and unassertive, while Chikane is bold and elegant. Despite this, they love each other, and nothing can come between them, no matter how hard they try.

On the two girls' shared birthday, a sinister voice corrupts one of their friends into attacking them, and just when it seemed grimmest, the lunar and solar priestess powers that lay dormant in the two girls awaken, dispelling the evil. That was only the first hurdle, however. The two must now fend off the countless others who would threaten their well-being—even the people closest to them!"
144,Kanon,"['Drama', 'Romance', 'Supernatural']",2774,7.06,"It’s been 7 years since Yuuichi Aizawa visited his aunt Akiko, but now that his parents have gone to Africa to pursue their careers, he is finally back in the little northern town. Yuuichi is not really overjoyed with the prospect of living here though, because all of his memories of this place and the people living in it have mysteriously vanished. His cute cousin Nayuki seems like a stranger as well, even though he used to play with her all the time when they were younger.

On the day of moving into his new home, Yuuichi starts unpacking the boxes and stumbles upon a red headband that no one seems to recognize. This is one of the first clues that will make Yuuichi take a stroll through the snow-covered town and make him start recalling fragments of his past, broken promises and buried secrets. Yuuichi soon realizes that there is something supernatural going on, and all of his new female acquaintances seem to have links to his forgotten past."
145,Kareshi Kanojo no Jijou,"['Comedy', 'Drama', 'Romance']",1064,7.6,"Yukino Miyazawa is the female representative for her class and the most popular girl among the freshmen at her high school. Good at both academics and sports on top of being elegant and sociable, she has been an object of admiration all her life. However, in reality, she is an incredibly vain person who toils relentlessly to maintain her good grades, athleticism, and graceful appearance. She wants nothing more than to be the center of attention and praise—which is why she cannot stand Souichirou Arima, the male representative for her class and the only person more perfect than her. Since the first day of high school, she has struggled to steal the spotlight from her new rival but to no avail.

At last, on the midterm exams, Yukino gets the top score and beats Souichirou. But, to her surprise, he congratulates her on her achievement, leading her to question her deceptive lifestyle. When Souichirou confesses his love to Yukino, she turns him down and gloats about it at home with only a hint of regret. But the very next day, Souichirou visits Yukino house to bring her a CD and sees her uninhibited self in action; now equipped with the truth, he blackmails her into completing his student council duties. Coerced into spending time with Souichirou, Yukino learns that she is not the only one hiding secrets.

[Written by MAL Rewrite]"
146,Kono Minikuku mo Utsukushii Sekai,"['Comedy', 'Drama', 'Romance', 'Sci-Fi', 'Ecchi']",2894,6.69,"High school student Takeru Takemoto works part time as a (motor)bike courier. During one of his deliveries, he saw a mysterious light passing him and fell into a forest. What he had found was a beautiful girl coming out from a glowing cocoon, calling herself ""Hikari."" While Takeru was quite embarrassed because of Hikari's nudity, a strange monster suddenly showed up and immediately attacked the two. Both Takeru and Hikari demonstrated the power of their other selves before Takeru had a clue of what's going on.

(Source: ANN)"
147,Kimi ga Nozomu Eien,"['Drama', 'Romance']",1657,7.17,"In the warmth of a golden sun, timid high school student Haruka Suzumiya confesses to Takayuki Narumi, the boy she admires. Takayuki accepts Haruka's confession and the two become a couple, supported by their mutual friends Mitsuki Hayase and Shinji Taira. All is well for these friends—until tragedy strikes. 

One of them is sent to an unenviable fate, lying dormant in a coma. Three years later, they awaken, but their sudden reappearance in everyone's lives threatens to test the limits of these friends' bonds.

[Written by MAL Rewrite]"
148,Kita e.: Diamond Dust Drops,"['Drama', 'Romance']",6648,6.56,"If a couple sees the diamond dust together, then they will certainly find eternal happiness. Or so it is said. This is a drama about the romances, friendships and conflicts of six girls from Hokkaido and how the diamond dust affects them and eventually links them together in the search for happiness. 

(Source: ANN)"
149,Loveless,"['Boys Love', 'Drama', 'Mystery', 'Supernatural']",1677,6.72,"In the world of Loveless, each person is born with cat ears and a tail, which disappear only if that person engages in a sexual intercourse. Because of this, they have come to symbolize virginity and innocence. Additionally, fighting is only done by ""fighting pairs"" or couples, where one is known as the Sacrifice and the other as the Fighter. The first receives the damage while the latter attacks.

Ritsuka Aoyagi is a 12-year-old boy, who for some unknown reason suffers from amnesia. His brother got killed recently, and as if his life has not been hard enough lately, on his first day at the new school he gets approached by a stranger called Agatsuma Soubi, who claims to have known his late brother. Ritsuka finds out that Agatsuma and his brother used to be a fighting pair, and that Agatsuma has inherited Ritsuka now that his brother is gone. Together, they try to find the truth behind his brother's death and the organization known as the ""Seven Moons,"" which may have been responsible for it. All the while, it seems that Ritsuka and Agatsuma are becoming closer than they intended to be…"
150,Blood+,"['Action', 'Drama', 'Horror', 'Mystery', 'Supernatural']",642,7.61,"Saya Otonashi is a seemingly ordinary girl living a mundane life with her adoptive family in Okinawa City. In fact, her only peculiarities are suffering from anemia and being unable to remember any of her life beyond the previous year.

However, Saya's forgotten past quickly comes back to haunt her—one night, she is attacked at school by a creature that feeds on human blood. Just when all hope seems lost, a mysterious man named Haji appears and fends off the creature temporarily. But when her rescuer forces her to drink his blood, Saya suddenly enters a trance and slays the monster with ease, using her own blood as a catalyst. 

Saya then learns of an organization named Red Shield, founded for the sole purpose of defeating the hellish beasts. Now Saya and Haji must work together with Red Shield to fight these fearsome monsters and unlock the secrets to the girl's past.

[Written by MAL Rewrite]"
151,Re: Cutie Honey,"['Action', 'Comedy', 'Girls Love', 'Sci-Fi', 'Ecchi']",4136,7.13,"The last words spoken to Honey Kisaragi by her father before his death at the hands of the mysterious organization Panther Claw have shaped her way of life. It is the sole reason she still continues to fight for the sake of others.

The energetic Inspector Natsuko Aki does her absolute best to apprehend the members of Panther Claw and bring them to justice, but they are simply too much for the police to handle. The only one who can give these criminals a run for their money is the sexy warrior of love and justice, Cutie Honey—the secret alter ego of Kisaragi. Although Natsuko refuses to acknowledge vigilantes, her relationship with Honey progresses for the better as the strong-headed detective realizes the true intentions behind Honey's actions.

Overtime, Honey grows more fearful of her burning desire for revenge; meanwhile, Natsuko wants to protect her friend, a sentiment that clashes with her ideals of upholding the law. If they ever hope to stand a chance against the menacing Panther Claw, the duo will have to put aside their differences and stand together.

[Written by MAL Rewrite]"
152,Solty Rei,"['Action', 'Sci-Fi']",4142,7.25,"In a future-based disaster-ridden city with an enormous gap between the rich and the poor, it is hard to tell which humans are walking around with cybernetic body parts. This makes Roy Revant's job as a renegade bounty hunter/bodyguard-for-hire even more difficult. When a young girl with unbeliveable strength rescues him from a particularly dangerous criminal, Roy realizes that perhaps help can be found in the strangest of places. Joining together with a few others, they engage in a battle to find out the truth behind the giant conglomerates that are supposedly serving mankind and making life better.

Solty, an android who has lost her memory, has escaped and is being hunted by the RUC Security Bureau. She encounters the bounty hunter Roy and he adopts her as his daughter after being hired as a bodygaurd for Miranda.

(Source: ANN)"
153,Juuni Kokuki,"['Action', 'Adventure', 'Fantasy']",1550,8.01,"Youko Nakajima has only ever wanted to be normal. She does what she is asked, gets good grades, is the class president, and even helps her classmates whenever she can—but because of her red hair, she has never fit in. With her pushover attitude, Youko lets classmates take advantage of her, so she has nobody she can really call a friend.

But on an otherwise ordinary day, a man who claims to be from another world barges into Youko's classroom and bows before her. This elegant blond-haired man, Keiki, claims that Youko is his master and belongs on the throne of his kingdom. However, their first meeting is cut short as Keiki has been followed by otherworldly beasts called youma. He is able to escape with Youko into his own realm, but two other classmates—Ikuya Asano and Yuka Sugimoto—are caught up in the madness as well. Unfortunately, their troubles have only just begun, as the youma attack leaves them separated from Keiki. Alone in this strange new land, these ordinary students must learn to fend for themselves or die.

[Written by MAL Rewrite]"
154,Shaman King,"['Action', 'Adventure', 'Supernatural']",665,7.73,"A battle is about to begin in Tokyo: the Shaman Fight, a tournament held every five hundred years where shaman—those who can command spirits—confront each other in combat. The victor of this contest becomes the Shaman King and the only one who is able to contact and control the Great Spirit, allowing them to reshape the world as they please through its immense power.

During a late night walk, Manta Oyamada runs into his classmate, the carefree You Asakura, who invites him to come stargazing with some friends, who, to Manta's horror, turn out to be ghosts from a local cemetery! However, the knowledge that Manta possesses—a rare sixth sense that allows Manta to see these spirits—endears the boy to You. So when You finds out that his new comrade has been beaten up by a local gang, he decides to avenge him with the help of Amidamaru, a samurai ghost whose tomb was broken by the gang leader. 

Soon Manta uncovers more about the world of spirits, including the Shaman Fight, in which his new friend You aims to claim victory.

[Written by MAL Rewrite]"
155,X/1999,"['Action', 'Drama', 'Fantasy', 'Mystery']",3677,6.56,"The future of the universe rests on one young man, Kamui Shiro, who must destroy either the Dragons of Earth or the Dragons of Heaven - two opposing armies. He alone must decide whether humanity should be destroyed to create a purified universe, or whether it should be protected to preserve civilization.

Two oracles, the sisters Hinoto and Kanoe foresee the coming of the Dragons and predict opposite outcomes. Each sister gathers strength and ammunition to insure her own vision for the future. However, neither sister realizes that there is one man who has an even greater power than the Dragons, and that ultimately he will determine the fate of the earth.

Which sister will prevail and how does Kamui fit into their struggle? The answer to this question will forever affect humanity.

(Source: Manga Entertainment)"
156,X,"['Action', 'Drama', 'Fantasy', 'Mystery']",2403,7.38,"In the fight between the Dragons of Heaven and the Dragons of Earth, the dream seer Princess Hinoto predicts the end of humanity. A central entity, 15-year-old Kamui Shirou, is to choose whether to ally with the Dragons of Earth and destroy civilization to protect the planet or with the Dragons of Heaven to save mankind.

Following his mother's last wish, Kamui returns to Tokyo after six years of self-imposed exile. There, he attempts to steal the Sacred Sword from the temple protected by Kyougo Monou—the father of his childhood friends, Fuuma and Kotori. However, after Kamui's venture fails, a mysterious person manages to obtain the sword instead.

Believing Kamui to be the man in her prophecy, Hinoto sends the Dragons of Heaven after him to rally him to their cause. Although Kamui first rejects his destiny, the incessant attacks by the Dragons of Earth against those he holds dear push him to decide whether the lives of his friends should prevail over the fate of the Earth and finally pick a side.

[Written by MAL Rewrite]"
157,Mahou Sensei Negima!,"['Action', 'Comedy', 'Fantasy', 'Romance', 'Ecchi']",1666,6.92,"10-year-old Negi Springfield is a wizard-in-training, and needs only to pass one more test in order to become a Master Wizard. Unfortunately, his final task is a bizarre one—to become a English teacher at an all-females boarding school. As soon as he arrives, he completely embarrasses one of his students, Asuna Kagurazaka, and replaces the teacher she loves, which garners her hatred. To make matters worse, Asuna learns that Negi is a wizard, and promises to tell unless he helps her out. But unfortunately, circumstances force them to work together to do many things, from fighting evil wizards to helping the class pass their final exam, with a lot of humor, magic, and romances thrown in.

(Source: ANN, edited)"
